number,old_definition,word,translation,definition,example_sentences,part_of_speech,collocations
127,一國貨幣的對外價值降低。[例]今日匯率市場，美元走俏，臺幣持續小幅貶值。,貶值,"To depreciate; to decrease in value or worth, particularly in relation to currency.",一國貨幣的對外價值降低。,貶值對經濟造成的沖擊，讓許多企業不得不重新評估他們的市場策略。 / 在貿易戰的影響下，該國的貨幣迅速貶值，使得外資流出加劇。 / 貨幣貶值雖然提高了該國產品的國際競爭力，但同時也引發了通貨膨脹的擔憂。 / 許多投資者對貶值的風險表示擔憂，因為這可能會影響到他們的資產回報。 / 近日，因為政策調整，該國的貨幣貶值幅度達到歷年來的新高，引起市場的廣泛關注。,vp-i/N,貶值的現象 / 貶值的風險 / 貶值的影響 / 持續貶值 / 大幅貶值
128,將線、柳條等細長的東西交錯穿結而形成面狀的東西。[例]老奶奶悠閒的躺在搖椅上編織毛衣。　◎,編織,To weave or knit by interlacing strands or materials.,將線、柳條等細長的東西交錯穿結，形成一個平面或立體的東西。,老師帶我們去參觀傳統工坊，看到工匠們如何用心編織出精美的作品。 / 編織藝術不僅需要技巧，還需要耐心和創造力。 / 每當她坐下來編織毛衣，就彷彿能把所有的煩惱都釋放出去。 / 在文化節上，學生們展示了自己編織的作品，受到大家的讚賞。 / 這個展覽讓我體會到編織不僅是一門手藝，更是一種文化的傳承。,va-t,編織毛衣 / 傳統的編織技藝 / 編織的藝術 / 手藝編織 / 古老的編織技術
128,比喻抽象的想像、規劃。[例]編織美夢、編織未來,編織,"To weave or create, often used metaphorically to describe the act of forming or planning something abstract, such as dreams or futures.",將抽象的想像或規劃相互結合，形成一個整體。,他花了很多時間編織未來的職業計劃，希望能實現自己的夢想。 / 每個孩子都應該有機會編織自己的夢想，不受任何限制。 / 媽媽總是善於編織幸福，她的每一個小動作都能讓家裡充滿溫暖和笑聲。 / 在這次社區活動中，居民們共同編織了環保的願景，讓每個人都能參與改善環境的行動。 / 在這部電影中，導演巧妙地編織了多個角色的命運，讓觀眾感受到深刻的情感共鳴。,va-t/N,編織夢想 / 編織未來 / 編織幸福 / 編織希望 / 編織願景
129,用線狀物或頭髮編成的長條。[例]她把頭髮紮成一條長辮子。,辮子,A braid; a long strip formed by weaving together hair or other linear materials.,用線狀物或頭髮編成的長條。,她的頭髮綁成兩條可愛的小辮子，看起來格外俏麗。 / 在夏天，很多小女孩都喜歡扎辮子，讓頭髮不會黏在臉上。 / 他看到路上有一位小女生綁著長辮子，忍不住多看了幾眼。 / 那位藝術家畫的少女正好綁著一條優雅的辮子，讓她看起來十分動人。 / 她把頭髮紮成一條長辮子，讓整個造型顯得清爽許多。,n,綁辮子 / 編辮子 / 留辮子 / 漂亮的辮子 / 長辮子
130,,鞭子,A whip; traditionally used for directing animals or as a tool for punishment.,用皮或綁的材料製成，通常用來驅動動物或用於某些運動。,在農村，農夫常用鞭子來驅趕牲畜。 / 在某些傳統文化中，鞭子被視為權威的象徵。 / 鞭子的聲音在空中回蕩，讓人感受到一種緊張的氣氛。 / 她在表演中巧妙地運用鞭子，展現了優雅與力量的結合。 / 鞭子的材質各有不同，有的甚至是用皮革精心製作而成。,n,一根鞭子 / 揮舞鞭子 / 拿著鞭子 / 鞭子抽打 / 用鞭子
131,編輯。[例]編纂成書,編纂,To edit and compile; to arrange and set in order.,編輯並整理材料，形成書籍或其他作品。,他們花了幾年時間，終於完成了編纂這部歷史文獻的工作。 / 在編纂這本字典時，他們考慮到不同方言的使用。 / 這本書的編纂過程十分繁瑣，但最終成果讓人滿意。 / 編纂資料時，她發現了許多珍貴的歷史照片。 / 他們每周都會進行編纂工作的進度檢查，以確保按時完成。,va-t,編纂成書 / 編纂資料 / 編纂文獻 / 編纂工作 / 編纂過程
132,標誌、符號。[例]正字標記,標記,A mark or symbol; a sign indicating something.,用來表示某種特定含義的標誌或符號。,老師在考卷上標記了錯誤的地方，以便學生能夠改正。 / 電子檔案的標記系統幫助我們快速找到需要的資料。 / 在地圖上，每個標記都代表著一個重要的景點或地點。 / 每一個標記都應該具有明確的含義，以避免混淆和誤解。 / 我們需要在實驗記錄中清楚地標記每一步，以便後續的分析。,標記's verb type: None/N,一個標記 / 明確的標記 / 使用標記 / 識別標記 / 資料標記
133,流露、顯示。[例]她的眼神表露出極度的恐慌。,表露,To reveal or display openly.,流露出內心的情感或思想，或明顯顯示出某種狀態。,她在聚會上談到自己的夢想時，神情中表露出強烈的決心和毅力。 / 在比賽前夕，選手們的緊張情緒在臉上表露無遺，顯示出他們對勝利的渴望。 / 這部電影的演員表露出深刻的情感，讓觀眾深切體會到角色的內心掙扎。 / 她在面對挫折時，堅強的外表下依然表露出對成功的渴望和不放棄的信念。 / 在志願活動中，志工們的笑容表露出對幫助他人的真誠喜悅與滿足。,va-t,表露情感 / 表露喜悅 / 表露不安 / 表露擔憂 / 表露恐懼
134,標明、揭示。[例]這塊牌子標示著「遊客止步」。,標示,To mark or indicate something clearly.,標明或揭示某種資訊或內容。,這個地圖標示了所有的景點和交通路線，非常實用。 / 在超市裡，各種商品都有詳細的標示，方便顧客選購。 / 這條路上的標示牌告訴駕駛人有施工，請減速慢行。 / 在藥品包裝上必須正確標示成分和使用方法，以保障用戶安全。 / 公園裡的步道兩旁都有標示，提醒遊客注意環境保護。,va-t,標示牌 / 清楚標示 / 標示出 / 正確標示 / 明確標示
135,表明態度，以說明自己的意見或想法等。[例]他頻頻表態，依然無法取得諒解。,表態,To express one's stance or opinion openly.,表明自己的態度，說明意見或想法。,在會議上，參與者都紛紛表態，以確保決策能夠得到大家的支持。 / 如果你對這個計畫有意見，請直接表態，不要害怕表達自己的想法。 / 社區居民對新建公園的計畫都表態支持，期待改善生活環境。 / 對於最近的環境問題，許多專家都表態呼籲政府採取更積極的行動。 / 在公益活動中，許多企業表態願意捐款，以幫助弱勢群體。,va-t/N,頻頻表態 / 明確表態 / 立場表態 / 向他人表態 / 直接表態
136,為宣傳而張貼的詞句。通常語句簡短、精鍊、意義明顯。如「流汗總比流血好」，可用來宣導騎士必須戴安全帽。,標語,"A slogan or tagline; a phrase posted for宣传 purposes, usually short, concise, and clear in meaning.",為宣傳而張貼的詞句，通常簡短、精鍊，意義明顯。,在社區活動中，志願者們張貼了許多宣傳標語，呼籲大家一起關心長者。 / 廣告標語「健康生活，從飲水開始」讓人們更注重日常飲水的重要性。 / 體育館門口貼著「運動讓生活更美好」的標語，鼓勵更多人參與運動。 / 旅遊景點以「探索美麗台灣，體驗不同風情」的標語吸引更多遊客前來。 / 每當國慶日來臨，街道上都會出現「團結就是力量」的標語，激勵市民共同慶祝。,n,一條標語 / 宣傳標語 / 廣告標語 / 引人注目的標語 / 政府的標語
137,表明特徵、識別的記號。[例]交通標誌,標誌,A sign or marker that indicates features or identifies something; [Example] Traffic sign.,表明特徵或識別的記號。,每一個國家都有自己獨特的國旗標誌，象徵著不同的歷史與文化。 / 此次環保活動中，志工們製作了醒目的標誌，提醒大家注意垃圾分類。 / 在城市裡，清晰的指示標誌幫助路人更快地找到目的地，減少迷路的困擾。 / 道路上的安全標誌十分重要，因為它們能有效地防止交通事故的發生。 / 在航海圖上，特定的標誌標示著危險水域，提醒船隻小心駛過。,n,標誌的設計 / 交通標誌 / 危險標誌 / 明確的標誌 / 道路標誌
138,壓抑、強忍。[例]憋氣、憋尿、憋在心裡,憋,"To suppress, withhold, or endure.",壓抑或強忍某種情感或生理需求。,他因為工作壓力大，經常憋著不說心裡的煩惱。 / 她憋著尿，忍不住要請求去洗手間。 / 每當感到壓力時，他都會選擇憋著情緒，不向任何人傾訴。 / 他憋著氣，心中充滿委屈卻不想讓別人擔心。 / 他憋著氣，努力讓自己冷靜下來，面對這個棘手的問題。,va-t,憋氣 / 憋尿 / 憋不住了 / 憋著不說 / 憋得受不了
139,本宅外另外建造的房舍，以供休閒遊憩，多建在景色優美之處。[例]這地方因景色宜人，沿溪畔蓋了很多別墅。,別墅,"A villa; A separate house built for leisure and recreation, usually located in a scenic area.",本宅外另外建造的房舍，主要用來休閒遊憩，通常建在景色優美的地方。,他們在湖邊買了一棟漂亮的別墅，每個周末都會去那裡放鬆。 / 在別墅的陽台上，看著日落，感受到一天工作的疲憊都消失了。 / 她夢想著有一天能夠擁有一棟面朝大海的別墅，享受悠閒的海邊生活。 / 在別墅的花園裡，種滿了各種花草，讓整個空間充滿了生氣與活力。 / 豪華別墅的泳池旁，朋友們一起享受著美食與美酒，度過了一個難忘的午後。,n,一棟別墅 / 豪華別墅 / 獨棟別墅 / 湖邊的別墅 / 設計別墅
140,水邊。[例]河瀕、江瀕,瀕臨/瀕,A riverbank or the edge of a river.,靠近水邊的地方。,在夏天，孩子們常常在河瀕的樹蔭下玩耍。 / 傍晚時分，散步的人們常常選擇在湖瀕的小路上享受寧靜的時光。 / 漁民們每天都在湖濱忙碌，希望能捕到豐富的魚獲。 / 在海瀕的沙灘上，人們享受著陽光和海浪的洗禮。 / 每當清晨，曙光照耀著瀕臨山腳的小溪，景色美得讓人驚嘆。,vs-i,河瀕 / 湖瀕 / 江瀕 / 海瀕 / 瀕臨水邊
140,臨近、迫近。[例]瀕臨、瀕危,瀕臨/瀕,To be close to or on the verge of something.,臨近或迫近某種狀態或情況。,許多動物因為栖息地的破壞而瀕臨滅絕。 / 世界上不少語言因為使用人數減少，現在正瀕臨消失的危機。 / 這種珍稀植物因為環境變化而瀕臨滅絕。 / 由於氣候變遷，許多沿海城市正瀕臨嚴重的淹水威脅。 / 這家公司若不改善管理，將瀕臨資金鏈斷裂的風險。,vp-i,瀕臨滅絕 / 瀕臨失控 / 瀕臨災難 / 瀕臨死亡 / 瀕臨破產
140,臨近、迫近。[例]老虎和犀牛都是瀕臨絕種的動物，我們要好好予以保護。,瀕臨/瀕,Lying close to or on the verge of something.,接近某種狀態或情況，通常指的是危險或不好的情況。,隨著氣候變化，極地冰蓋若繼續融化，將使我們的生態系統瀕臨崩潰。 / 由於過度捕撈，某些魚類的數量已經瀕臨滅絕，這引起了科學家的廣泛關注。 / 在經濟危機的影響下，許多小企業面臨瀕臨倒閉的困境，亟需政府的援助。 / 隨著社會變遷，許多小語種的使用者逐漸減少，這些語言的存續正瀕臨危機。 / 為了拯救瀕臨絕種的動物，保護團體積極展開各種宣傳和救助活動。,vp-i,瀕臨絕種 / 瀕臨崩潰 / 瀕臨災難 / 瀕臨死亡 / 瀕臨滅亡
141,天干的第三位。,丙,The third of the ten Heavenly Stems (天干).,天干的第三位。,在中國古代，十天干當中的丙常被用來記錄年份和月份。 / 按照五行理論，丙屬於火，這意味著它代表著光明和熱情。 / 雖然丙是天干中的第三位，但它對命理的影響卻不可小覷。 / 今年是丙年，很多人期待著新的機會和挑戰。 / 丙的屬性讓它在中國傳統文化中有著特殊的地位和象徵。,n,甲乙丙丁 / 干支丙年 / 丙的火元素 / 丙年的運勢 / 丙的屬性
141,用來排列次序等第的字。表示第三。[例]丙班、丙等,丙,The third in a sequence or ranking.,用來排列次序的字，表示第三。,在學校的比賽中，丙組獲得了第三名的好成績。 / 在這次的專業測驗中，丙等考生的表現也相當優秀。 / 他在籃球賽中投中關鍵三分球，幫助丙隊逆轉了比賽。 / 如果你在學期末考試中取得丙級成績，就可以獲得獎學金的申請資格。 / 在體育嘉年華中，丙組選手們的團結協作讓比賽充滿了歡樂與熱情。,num,丙班 / 丙等 / 甲乙丙 / 丙級 / 丙組
