number,old_definition,word,translation,definition,example_sentences,part_of_speech,collocations
418,佛教用語。慈指給予眾生安樂；悲指拔除眾生的痛苦。後轉為慈愛、悲憫的意思。[例]多數的宗教本著慈悲為懷的精神，教導世人互助互愛。,慈悲,"Buddhist term referring to compassion and mercy; '慈' (cí) means to provide happiness and comfort to all beings, while '悲' (bēi) signifies the alleviation of suffering.",佛教用語。慈是給予眾生安樂，悲是拔除眾生痛苦。這種精神後來轉為慈愛和悲憫。,許多宗教都提倡「慈悲為懷」的價值觀，鼓勵人們互相幫助。 / 他常常在街上看到流浪動物，心中生出慈悲之情，於是決定帶牠們回家照顧。 / 在醫院裡，護士們展現出非凡的慈悲，耐心地照顧每一位病人。 / 當他看到弱者受到不公正對待時，心中充滿了慈悲，決定站出來發聲。 / 他的作品充滿了慈悲與理解，讓人們感受到生命的價值與希望。 / 當我目睹那些困境中的人，我心中充滿了慈悲，立刻想要提供幫助。 / 很多志願者在災區工作，正是因為心懷慈悲，希望能減輕受災者的痛苦。 / 在閱讀那些描寫人性與慈悲的文學作品時，深深被其中的情感所打動。 / 這位老師以慈悲的心腸對待每一位學生，幫助他們克服學習上的困難。 / 社會上需要更多的人發揮慈悲，讓世界變得更加溫暖與和諧。 / 在日常生活中，我們應該時常提醒自己，懷抱慈悲的心來對待身邊的人。,n,慈悲為懷 / 慈悲心腸 / 充滿慈悲 / 以慈悲對待 / 體現慈悲 / 慈悲的力量 / 教導慈悲 / 實行慈悲 / 表現慈悲 / 發揮慈悲
419,比喻言語不中聽。[例]他的話雖刺耳，卻是誠意的直諫，最後仍被接受了。,刺耳,"Grating; harsh, unpleasant, or jarring to the ears, often used to describe loud or discordant sounds.",形容言語不中聽，讓人感到不舒服。,面對朋友的刺耳批評，她一開始很不高興，但後來明白是為了她好。 / 老師的話雖然刺耳，但他希望學生能夠反思自己的行為。 / 這首歌的高音部分聽起來刺耳，讓我想要跳過那段。 / 他在會議上提出的刺耳意見，讓在場的人都感到震驚。 / 雖然父母的提醒有些刺耳，但我知道他們是出於關心。 / 這個城市的交通噪音實在刺耳，讓我難以入睡。 / 聽到那則刺耳的新聞報導，我的心情一下子變得沉重起來。 / 虽然他的忠告聽起來刺耳，但我知道他是出於好意。 / 當她聽到那個刺耳的真相時，眼淚忍不住流了下來。 / 他的直言不諱讓有些同事感到刺耳，但大家也不得不佩服他的誠實。 / 這部電影中的某些對話實在刺耳，讓觀眾感到不適。,vs-adj,刺耳的話 / 刺耳的聲音 / 刺耳的批評 / 直言不諱刺耳的意見 / 聽起來刺耳 / 面對刺耳的事實 / 刺耳的真相 / 雖然刺耳但 / 感到刺耳 / 讓人刺耳
419,聲音尖銳或吵雜，使耳朵難受。[例]長期暴露在刺耳的噪音中，容易使人精神緊張。,刺耳,"A sharp, harsh, or grating sound that is unpleasant to the ear.",聲音尖銳或吵雜，讓耳朵感到難受。,從遠處傳來刺耳的刮擦聲，讓我忍不住皺起眉頭。 / 這首歌的某些高音部分實在刺耳，讓人聽得不太舒服。 / 我不小心開太大聲，客廳裡的音響發出刺耳的回音。 / 他的指責讓我感到刺耳，心裡不禁想反駁。 / 媽媽在廚房裡發出的刺耳鍋碗瓢盆碰撞聲，讓我無法集中精神學習。 / 隔壁傳來刺耳的音樂聲，讓我無法專心做作業。 / 在寧靜的夜晚，突然響起的刺耳警報聲令我驚醒。 / 他在會議上發表的刺耳批評讓同事們都感到緊張和尷尬。 / 那場電影裡的某些場景配樂刺耳得讓我覺得不適。 / 公園裡的小孩刺耳的尖叫聲打破了原本的寧靜。 / 刺耳的海浪聲在岸邊不斷回蕩，讓人感到一種莫名的焦慮。,vs-adj,刺耳的聲音 / 刺耳的噪音 / 刺耳的音樂 / 刺耳的尖叫 / 刺耳的批評 / 刺耳的回音 / 刺耳的聲響 / 刺耳的警報 / 刺耳的歌聲 / 刺耳的聲調
420,侍奉、服侍。[例]他出身富豪之家，從小養尊處優，事事有人伺候。,伺候,"To serve or attend to someone, often with the connotation of providing care or support.",侍奉和服侍他人，通常是為了滿足需求。,在這家五星級飯店裡，侍應生專心伺候每一位客人，以確保他們的用餐體驗無比舒適。 / 他們的廚師不僅技術高超，還專門訓練助手，學會如何細心伺候每個顧客。 / 她發現，伺候別人的同時，其實也讓自己感受到一種難以言喻的喜悅。 / 小時候，祖父常教我尊重和感恩那些伺候我們的人，因為他們的工作不容易。 / 最近，志工團體開始定期拜訪孤老，認真伺候他們的生活起居，希望帶去更多溫暖。 / 孩子們學習如何伺候長輩，這不僅是責任，還能增進家庭的親密感。 / 在這場婚禮上，新郎新娘的朋友們都熱情伺候賓客，讓每個人都感受到賓至如歸的氛圍。 / 當她出國旅行時，當地的向導細心伺候，介紹每一個景點的歷史與文化，讓她十分感動。 / 為了提升服務品質，酒店最近舉辦了專業培訓，教員工如何更有效率地伺候客人。 / 她常常笑著說，伺候別人其實也是一種快樂，能讓生活更加充實。 / 公司特別安排了專人來伺候來訪的重要客戶，以展示他們的專業與誠意。,va-t,伺候人 / 伺候主人 / 伺候客人 / 伺候父母 / 伺候長輩 / 認真伺候 / 熱情伺候 / 隨時伺候 / 伺候飲食 / 孝順伺候
421,以瓷土燒製成的器物。坯質具半透明性，不吸水，焙燒溫度較陶器高，成品質地堅硬細緻，叩之有金石聲。表面塗有玻璃質的釉，細膩富光澤。[例]瓷器是中國古代重要的特產，故中國有「瓷國」的稱呼。　△瓷、磁器,瓷器,"Fine china; A type of ceramic ware made from kaolin, characterized by its high firing temperature, translucence, low water absorption, and a glossy, smooth surface. It is known for its hardness and ability to produce a ringing sound when tapped.",以瓷土燒製成的器物，具半透明性，不吸水，焙燒溫度較陶器高，成品質地堅硬細緻，叩之有金石聲。表面塗有玻璃質的釉，細膩富光澤。,這家店專賣高品質的瓷器，每一件都非常精緻。 / 他的家裡收藏了許多古代的瓷器，每一件都有其獨特的故事。 / 在拍賣會上，一件清朝的瓷器以高價成交，讓所有人都感到驚訝。 / 我非常喜歡那幅描繪瓷器的油畫，畫中展現了瓷器的光澤與細緻。 / 耶誕節的時候，朋友送我一對精美的瓷器，讓我非常感動。 / 這件瓷器的表面釉色光滑，反射出柔和的光線，非常迷人。 / 他在旅行中買到了一套當地特色的瓷器，給他的家增添了許多色彩。 / 博物館裡展出了一件罕見的明代瓷器，吸引了許多藝術愛好者前來欣賞。 / 清洗瓷器時要小心，以免刮傷表面的光澤。 / 這件義大利瓷器以其獨特的設計和精緻的手工藝而聞名。 / 在家庭聚會上，大家都喜歡用這些精美的瓷器來盛放美食，讓餐桌更加豐盛。,n,一件瓷器 / 收藏瓷器 / 清洗瓷器 / 展示瓷器 / 購買瓷器 / 古代的瓷器 / 精美的瓷器 / 奢華的瓷器 / 代表性的瓷器 / 瓷器易碎
422,,辭去,To resign or leave a position voluntarily.,辭去是指主動放棄某個職位或工作，通常是由於個人意願或情況改變。,她因為家庭原因，決定辭去這份工作。 / 雖然辭去的決定讓他感到痛苦，但他知道這對自己是最好的選擇。 / 總經理突然辭去，讓整個公司感到震驚。 / 她向上級正式辭去後，開始探索自己的新職業方向。 / 他難過地辭去參賽資格，因為他的父母希望他專心學業。 / 由於健康狀況惡化，他不得不辭去多年來的職位。 / 在思考很久之後，張先生最終平靜地辭去自己的職位。 / 這位老師自願辭去教職，去海外進行志願服務。  / 辭去這份工作後，她開始追尋自己的藝術夢想。 / 雖然辭去的過程艱難，他仍然勇敢地面對未來的挑戰。 / 由於職業發展的需要，她決定辭去現有的工作，前往另一家公司任職。,vp-i,向上級辭去 / 正式辭去 / 突然辭去 / 自願辭去 / 工作辭去 / 因為辭去 / 難過地辭去 / 平靜地辭去 / 勇敢地辭去 / 必須辭去
423,第二天。[例]他們正在收拾行李，預備次日回國。,次日,The next day; the day after.,第二天。,他們訂了次日的機票，準備前往巴黎。 / 次日的會議安排了討論新專案的計劃。 / 她告訴朋友，次日他們將一起去爬山。 / 次日，天氣預報顯示會有小雨，因此他們決定改變計劃。 / 這本書的次日評價很高，讓作者感到驚喜。 / 他們正在收拾行李，預備次日回國。 / 次日的行程中，包括參觀博物館和品嚐當地美食。 / 他們計劃次日早上出發，以避開交通高峰期。 / 次日，他們在酒店享用了豐盛的早餐，然後出發探索城市。 / 次日的新聞報導了這次活動的成功，吸引了更多參與者。 / 由於次日的工作計劃繁忙，他們決定今晚提前休息。,n,明天的次日 / 次日的行程 / 次日的安排 / 次日的計劃 / 次日的工作 / 次日的會議 / 次日的活動 / 次日的交通 / 次日的新聞 / 次日的重要性
424,仁慈而好善。《北史．卷四四．崔光傳》：「光寬和慈善，不忤於物。」《初刻拍案驚奇》卷二○：「只為為人慈善，以致召禍，累了我兒。」,慈善,Kind and charitable; characterized by kindness and a desire to do good.,仁慈而好行善，心存善念，幫助他人。,她每年都會參加慈善活動，幫助那些需要幫助的人。 / 許多企業積極參與慈善事業，提升企業形象的同時，也回饋社會。 / 這位慈善家用自己的財富，改善了許多孩子的教育環境。 / 我們可以透過小額捐款，支持當地的慈善機構。 / 參加慈善晚會，不僅能享受美好的夜晚，還能為需要的人出一份力。 / 無論是在國內還是國外，慈善工作都是人們關心社會的一種表現。 / 他們的慈善活動不僅限於捐款，還包括志願服務，幫助弱勢群體。 / 每次聽到關於慈善的新聞，我都深受感動，想要更多地參與其中。 / 慈善機構的成立，讓更多人看到了愛心和希望的力量。 / 為了推廣慈善理念，學校定期舉辦相關的講座和活動。 / 這個社區的居民團結一致，共同為慈善籌款，展現了人們的關愛精神。,n,慈善機構 / 做慈善工作 / 參加慈善活動 / 慈善家 / 提供慈善捐款 / 舉辦慈善晚會 / 為慈善募款 / 向慈善機構捐款 / 慈善活動的目的 / 社會慈善責任
425,像針扎入皮肉般的疼痛。如：「迕逆的話讓父母聽來內心十分刺痛。」,刺痛,"A sharp pain, like being stabbed by a needle; often used metaphorically to describe emotional or psychological hurt.",像針扎入皮肉般的疼痛。,他對我說的那些冷漠話語，讓我感到心裡一陣刺痛。 / 我一直想要忘記過去的傷慘，但回憶還是一陣陣刺痛我的心。 / 在看到昔日好友的合照時，心中湧起一陣刺痛的感覺。 / 他拒絕我的請求，讓我心中感受到刺痛與失落。 / 學校的升學壓力讓我每天都經歷一種刺痛般的焦慮。 / 聽到她拆聲說她要搬走了，我心裡不禁一陣刺痛。 / 在回家的路上，想到曾經的快樂時光，心中再次感到一陣刺痛。 / 他的背叛讓我感到心裡深處的刺痛，難以釋懷。 / 當我讀到那篇描述失去的文章時，心中也不由自主地感受到刺痛。 / 單曲的旋律讓我回想起過去，那段記憶如同刺痛般侵入我的心。 / 刺痛的言語讓我意識到，這段關係或許無法繼續。,n,刺痛的感覺 / 心裡的刺痛 / 無法忍受的刺痛 / 刺痛的記憶 / 突然的刺痛 / 強烈的刺痛 / 感受到刺痛 / 心靈的刺痛 / 刺痛的言語 / 心中的刺痛
426,依次排列的順序。[例]乘車應排隊依先後次序上下車，不要爭先恐後。,次序,A sequence or order in which items are arranged in a specific manner.,依照一定的排列順序。,我們應該按照次序完成作業，這樣才能提高效率。 / 在參加會議時，發言的次序通常由主持人來決定。 / 排隊時，如果不按照次序，會導致混亂和不滿。 / 每個人都應該尊重排隊的次序，這是一種基本的社會禮儀。 / 在整理書籍時，按照字母的次序排列會讓查找變得更簡單。 / 在進行實驗時，必須遵循正確的次序，以確保結果的可靠性。 / 在軍隊中，指令的執行次序非常重要，直接影響到任務的成功與否。 / 在學校進行演講比賽時，選手的上台次序會提前公布。 / 在烹飪的過程中，食材添加的次序會影響到菜品的風味。 / 旅行時，安排景點的次序可以讓行程更加高效和愉快。 / 在完成日常任務時，按照優先級的次序處理可以降低壓力和錯誤率。,n,先後次序 / 排隊次序 / 按照次序 / 安排次序 / 事件次序 / 執行次序 / 處理次序 / 進入次序 / 整理次序 / 重要次序
427,比較不重要的。[例]先把主要問題解決，再來談次要問題。,次要,Secondary; comparatively less important.,比較不重要的事物或問題。,在討論計畫時，次要的細節可以稍後再處理。 / 與會者一致認為，解決主要問題後，才能轉向次要的問題。 / 在這次會議中，次要的議題被自動延後到下一次討論。 / 本次調查顯示，次要的因素對整體結果影響不大。 / 老闆要求團隊先完成主要任務，然後再考慮次要的任務。 / 我們應該優先集中精力處理主要挑戰，次要的挑戰可以在之後再討論。 / 這部電影的次要角色雖然不多，但每一位演員都表現得非常出色。 / 在寫作過程中，作者注意到次要的觀點可以為論文增添深度，但不必佔據主要篇幅。 / 教師提醒學生，重點應放在主要考點上，次要的知識可以作為補充。 / 在這個項目中，次要的需求雖然重要，但不會影響整體的進度。 / 面對緊急情況，我們必須先處理主要的危機，次要的問題稍後再考慮解決方案。,vs-adj,主要的問題 / 次要的問題 / 次要的角色 / 次要的任務 / 次要的影響 / 次要的因素 / 次要的細節 / 次要的業務 / 次要的目標 / 次要的責任
428,,次於,Second to; Inferior to or ranked below.,某事物在程度、地位或品質上低於另一事物。,他的成績雖然不錯，但次於校內的幾位優秀同學。 / 這部電影在票房上表現良好，但次於當年的熱門大片。 / 雖然這本書很受歡迎，但在文學價值上，許多評論家認為它次於經典名著。 / 在這次競賽中，她的表現次於其他參賽者，讓她感到有些失落。 / 這幅畫的技術水平雖然高，但次於藝術大師的作品，讓人感到驚訝。 / 在所有的候選人中，他的經歷次於那些有豐富工作背景的人。 / 這款手機的性能優秀，但在市場佔有率上仍次於競爭對手。 / 雖然這道菜味道很好，但在餐廳的熱門菜單中，它次於幾道招牌菜。 / 這篇論文的研究內容很有意義，但在學術影響力上次於其他領域的頂尖研究。 / 這家公司的業績雖然穩定，但在行業排名中卻次於幾家知名企業。 / 此次考試他的分數達標，但次於他平時的優秀表現，讓他感到稍微遺憾。,prep,次於困難 / 次於挑戰 / 次於艱難 / 次於障礙 / 次於艱辛 / 次於複雜 / 次於難題 / 次於麻煩 / 次於棘手 / 次於困境