number,old_definition,word,translation,definition,example_sentences,part_of_speech,collocations
404,掛在窗上用來遮蔽光線或視線的竹簾。[例]臥室裡掛窗簾可以遮光、透氣，有助於安睡。,窗簾,"Bamboo curtain hanging on a window, used to block light or视线.",掛在窗上，用來遮蔽光線或視線的布或其他材料。,清晨，陽光透過窗簾，房間顯得格外柔和。 / 選擇一副合適的窗簾，可以提升室內的整體美感。 / 在炎熱的夏天，窗簾能有效地阻擋陽光，讓室內保持涼爽。 / 我喜歡在下午時分，拉開窗簾，享受戶外的美麗風景。 / 每當有客人來訪，我總會特意整理一下窗簾，讓房間看起來更整潔。 / 窗簾的材質對於隔音效果也有很大的影響，厚重的窗簾能有效降低噪音。 / 在夜晚，關上窗簾可以增加隱私，讓我感到更安心。 / 我經常會根據季節變換窗簾，來增添不同的氛圍和色彩。 / 自從換了新窗簾，整個房間的感覺都變得明亮了許多。 / 清洗窗簾是家庭清潔中不可忽視的一環，定期清洗能保持它們的美觀。 / 這幅窗簾的設計靈感來自於自然，讓人感覺宛如置身於戶外。,n,一副窗簾 / 遮陽的窗簾 / 打開窗簾 / 關上窗簾 / 清洗窗簾 / 選擇窗簾 / 窗簾的風格 / 窗簾設計 / 裝飾窗簾 / 厚的窗簾
405,受外力造成的皮膚或其他組織損傷。[例]常見的創傷有割傷、刺傷和擦傷。,創傷,A wound; A skin or tissue injury caused by external force.,受外力造成的皮膚或其他組織損傷。,在戰爭中，士兵們經常面臨嚴重的創傷與殘缺，堅強面對困難。 / 媒體報導了社會事件造成的心理創傷，強調需要更多支持。 / 在事故中，創傷的類型多樣，包括割傷、擦傷和燒傷等。 / 醫生說，及早治療創傷可以減少日後的併發症。 / 這部電影讓觀眾看到了人物如何面對心靈創傷，並努力尋找療癒之道。 / 創傷的癒合需要時間，患者應該保持耐心。 / 許多人在自然災害後，經歷了深刻的創傷，心理輔導成為重要的支援。 / 藝術療法被認為對於治療創傷後的壓力反應有積極的效果。 / 在社區裡，志願者們積極參與幫助傷者恢復，減輕他們的創傷感受。 / 學校為學生提供心理諮詢，幫助他們應對家庭變故帶來的創傷。 / 在急救訓練中，學員們學習如何迅速處理不同類型的創傷，以保護傷者的生命。,n,創傷的癒合 / 治療創傷 / 心理創傷 / 嚴重的創傷 / 造成創傷 / 預防創傷 / 感受到創傷 / 創傷後反應 / 外傷和創傷 / 面對創傷
405,傷口、傷害。[例]這件事對他的打擊很大，他需要時間來撫平心理所受的創傷。,創傷,A wound or injury.,傷口或傷害，特別是指心理上的困擾。,這位戰士在戰鬥中受到了創傷，但他仍然勇敢地站起來繼續奮鬥。 / 在醫院，醫生細心地為創傷患者進行傷口清理和包紮。 / 他的童年經歷帶來了嚴重的情感創傷，影響了他成年後的親密關係。 / 在心理諮商中，專家幫助她逐步面對和療癒過去的創傷。 / 這部電影深刻描繪了角色在戰爭後的創傷，讓觀眾感同身受。 / 很多人在經歷重大事件後，出現創傷後壓力症候群，需要專業的治療來恢復正常生活。 / 社區舉辦工作坊，幫助居民了解創傷的影響與應對技巧。 / 他在事故中受到的生理創傷，讓他不得不重新評估自己的生活目標。 / 學校設立心理輔導中心，以協助學生處理因家庭問題而造成的創傷。 / 醫療團隊定期對創傷患者進行評估，以便制定最有效的康復計劃。 / 這本書探討了創傷對人際關係的長期影響，讓讀者重新思考情感連結的重要性。,n,心理創傷 / 創傷治療 / 創傷後壓力症候群 / 身體創傷 / 創傷恢復 / 創傷患者 / 情感創傷 / 創傷性事件 / 創傷評估 / 創傷預防
406,晚輩受長輩關愛的敬語。[例]垂愛、垂詢、垂念,垂,To bestow affection or care from a senior to a junior; a respectful term indicating that a junior is receiving kindness or attention from a senior.,對晚輩表示關愛或關心的敬語。,受到教導的長輩對晚輩表示垂訓，讓他們倍感珍惜。 / 我很感激長輩的垂愛，讓我在成長的過程中更有信心。 / 每當我遇到困難時，總能感受到父母的垂關心，讓我倍感溫暖。 / 垂詢學長的意見，讓我對未來的方向更加清晰。 / 雖然他身處異國，但我依然能感受到祖母的垂念，讓我倍感親切。 / 感謝您的垂教，這些寶貴的經驗將伴隨我一生。 / 學校的老師對於學生的未來深表垂愛，經常舉辦職涯規劃講座。 / 在我面臨選擇時，好友的垂詢讓我重新思考了我的決定。 / 每當節日來臨，我都能體會到親戚們對我的垂關心，讓我感受到家庭的溫暖。 / 垂詢專家的建議，對於解決這個複雜問題非常有幫助。 / 感謝您對我的垂恩，讓我在困難時刻感受到支持和力量。,vs-t,垂愛 / 垂詢 / 垂念 / 垂教 / 垂訓 / 垂問 / 垂惠 / 垂恩 / 垂慈 / 垂青
406,東西一頭由上直掛而下。[例]垂掛、垂釣、垂涎,垂,To hang down vertically.,東西一頭由上直掛而下。,树枝上垂着一串晶莹的露珠，让清晨的空气更加清新。 / 她的长发在微风中轻轻垂落，给她增添了一丝温柔。 / 夕阳西下，天边的云彩慢慢垂染上了金黄色，令人感叹大自然的美丽。 / 他心情不好时，总是垂着头，不愿意和周围的人交谈。 / 小孩在公园里垂下手，专心观察地上的小虫子，显得十分投入。 / 她坐在窗边，望着远方的山峦，心中不禁泛起了一阵思念，眼眸微微垂下。 / 老人在街角静静地垂下手，似乎在回忆年轻时的点点滴滴。 / 随着夜幕降临，星星在天空中逐渐显现，仿佛在垂直地闪烁着光芒。 / 弓箭手专注地瞄准目标，手中的弓箭垂直于地面，充满了力量。 / 悬崖边，藤蔓垂下，像一条绿色的丝带，在风中轻轻摇曳。 / 在博物馆里，古老的画作挂在墙上，画中人物的目光似乎也在垂视着观众。,vp-i,垂直线 / 垂头丧气 / 垂钓线 / 垂涎三尺 / 垂下头 / 垂青人 / 垂直的线条 / 安静地垂下 / 垂涎欲滴的美食 / 由高处垂下
406,留傳後世。[例]永垂不朽、名垂青史,垂,To be passed down through generations; to be recorded or remembered in history.,留傳下來，不會消失。,這位大學教授的學術成就不僅豐富了知識領域，也永垂不朽，影響了無數後學。 / 在紀念館裡，展示著這位偉人一生的事跡，讓他的名字得以永垂不朽。 / 那位藝術家的作品感動了很多人，讓他的才華和精神永垂不朽。 / 無論時光如何變遷，這首經典的老歌將永垂不朽，流傳於世。 / 在每年的紀念活動中，大家都會講述那位英雄的故事，讓他的精神永垂不朽。 / 這位作家的小說雖然出版多年，但因其深刻的主題依舊影響著年輕一代，讓他的名字更加永垂不朽。  / 在校園裡，師長們經常提到那位傑出校友的成就，讓他的精神在學校中永垂不朽。  / 這部電影以其感人的情節和真摯的情感，讓導演的藝術才華得以永垂不朽。  / 隨著時間的推移，這些科學家的研究成果仍然在學術界發揮著重要作用，讓他們的名字永垂不朽。  / 每當人們唱起那首傳世之曲，都感受到作者的情感與心血，讓其音樂作品永垂不朽。  / 這位慈善家的無私奉獻，為社會帶來了深遠的影響，使他的事蹟更加永垂不朽。,vs-i,永垂不朽 / 名垂青史 / 垂訓後人 / 垂光於世 / 垂恩於眾 / 垂示教誨 / 垂青後輩 / 垂名於史 / 垂範後輩 / 垂影長存
406,即將、將要。[例]生命垂危、功敗垂成,垂,Imminent; about to happen or occur.,將要發生，處在接近某種狀態的時刻。,在戰爭的邊緣，和平的希望似乎垂危。 / 醫生告訴家屬，病人的生命已經垂危，請做好心理準備。 / 隨著天色漸晚，旅客們感受到安全問題越來越垂危。 / 這個項目即將完成，但預算問題讓團隊的努力看起來功敗垂成。 / 在面對重重困難時，企業的經營狀況也變得十分垂迫。 / 他的事業壯志曾經高昂，但隨著競爭的激烈，如今已經垂落。 / 環境保護的聲音越來越小，地球的未來似乎垂危，急需行動。 / 隨著科技的迅速發展，傳統行業的生存空間逐漸垂縮。 / 隨著老齡化問題的加劇，社會保障系統面臨著垂裂的挑戰。 / 這段感情經歷了太多波折，如今已經隱約垂淡。 / 當知識更新的速度加快，他的學習進度卻越發垂迫，令人憂心。 / 這筆投資的回報率不如預期，讓整個計畫變得功虧一簣，前景垂危。,vp-i,生命垂危 / 功敗垂成 / 時間垂迫 / 年齡垂暮 / 命運垂危 / 精力垂竭 / 安全垂危 / 學業垂危 / 關係垂裂 / 感情垂淡
407,用拳頭或棒棰敲打。[例]捶背、捶胸頓足、捶洗衣物　◎,捶,To pound or hit with a fist or a stick.,用拳頭或棒棰敲打。,每天下班後，他喜歡捶打一下僵硬的肩膀，放鬆肌肉。 / 孩子們在遊戲時打鬧，偶爾會捶到彼此，讓大人們擔心會受傷。 / 他跑完步後，常常會用力捶捶自己的大腿，幫助血液循環。 / 在健身房，一些人會捶胸頓足，以挑戰自我的極限。 / 老王每次疲勞之時，就會用力捶幾下桌子，發洩內心的壓力。 / 她在電影院裡緊張得捶捶自己的腿，希望能減輕對情節的焦慮感。 / 每次看到精彩的比賽，他都忍不住捶捶自己的膝蓋，為球員們加油打氣。 / 偶爾，她會在家裡捶捶沙發，試圖舒緩一天的疲憊。 / 他在爬完山後，經常捶捶自己的小腿，以減輕肌肉的酸痛感。 / 朋友聚會時，大家會開玩笑捶捶對方的背，享受輕鬆的氣氛。 / 每當心情沮喪時，她就會捶捶自己的胸口，試圖找到安慰和釋放的方式。,va-t,捶背 / 捶胸 / 捶打 / 捶腿 / 捶膝蓋 / 捶肩膀 / 捶臀部 / 捶胳膊 / 捶桌子 / 捶小腿
408,數學上指兩條直線、兩個平面或一直線與一平面以直角相交。[例]同一平面上的兩條直線垂直必有一個交點。,垂直,"Perpendicular; in mathematics, referring to the relationship between two lines, two planes, or a line and a plane that intersect at a right angle.",在數學中，兩條直線、兩個平面或一直線與平面以直角相交。,垂直的兩條線在交點處形成了直角。 / 教室的黑板和地面的角度是垂直的，方便學生看清楚內容。 / 在建築設計中，柱子必須垂直於地面，以保持結構的穩定。 / 當我們畫幾何圖形時，垂直線的標記非常重要。 / 垂直投影可以幫助我們了解物體在空間中的位置關係。 / 在數學課上，老師教我們如何找出兩條垂直線的交點。 / 繪製立體圖形時，確保邊緣之間的垂直關係有助於形成正確的形狀。 / 垂直的光線能夠清晰地照亮物體，使得細節更加明顯。 / 在物理實驗中，我們測量了從高處垂直落下的物體的速度。 / 確認電梯的運行方向是垂直的，以便安全快速地到達每一層樓。 / 在戶外，樹木通常直立成垂直的姿態，形成美麗的自然景觀。,vs-i,垂直線 / 垂直平面 / 垂直交點 / 垂直關係 / 垂直距離 / 垂直高度 / 幾何垂直 / 垂直運動 / 垂直排列 / 垂直投影
409,蟲類蠕動。[例]蠢動、蠢蠢欲動,蠢,To writhe or squirm; often used to describe the movement of insects.,指像蟲類一樣向某個方向緩慢而不斷地爬動。,這隻小蟲在葉子上蠢蠢欲動，好像想要找到食物。 / 當天氣變暖時，地下的蟲蠕動著，開始準備迎接春天。 / 我覺得身體裡有一股蠢蠢欲動的能量，想要出去運動。 / 在黑暗的角落裡，幾隻蠢動的昆蟲讓我感到不自在。 / 他在教室裡蠢蠢欲動，似乎對即將來臨的下課時間充滿期待。 / 他們的思想在蠢蠢欲動，急切地想要表達自己的觀點。 / 在夜晚的靜謐中，我感覺到心裡有一種蠢蠢欲動的思緒，想要開始創作。 / 當我看到那本新書時，心中蠢蠢欲動的好奇心驅使我立刻翻閱。 / 他的手指在桌上蠢蠢欲動，顯示出他對這場討論的興奮與焦慮。 / 隨著音樂響起，舞池中人們的身體蠢蠢欲動，沉浸在節奏之中。 / 小朋友在公園裡蠢蠢欲動，迫不及待地想要參加遊戲。,vp-i,蠢蠢欲動 / 蠢動的蟲子 / 蠢動的感覺 / 蠢動的生物 / 蠢動的神經 / 蠢動的動作 / 蠢動的身體 / 蠢動的靈魂 / 蠢動的意識 / 蠢動的情緒
409,愚笨。[例]愚蠢、蠢材,蠢,Foolish; stupid; lacking intelligence.,愚笨的意思。,他的計畫聽起來十分蠢，根本不可能實現。 / 她覺得自己當初的選擇實在蠢得要命，浪費了很多時間。 / 在那次聚會上，他竟然說出一些蠢話，讓大家都尷尬不已。 / 他不小心拍了蠢照片，結果被朋友們拿來取笑了好一陣子。 / 她總是做一些讓人無法理解的蠢事，讓朋友們感到無奈。 / 有時候，我們都會因為情緒而做出蠢得不得了的決定。 / 他覺得自己當初的錯誤實在蠢極了，導致了一系列不必要的麻煩。 / 在課堂上，他發表了一些蠢見解，讓老師不禁搖頭嘆息。 / 她常常因為小事而感到蠢得要命，卻又無法自拔。 / 大家都在期待精彩的比賽，他卻在關鍵時刻做出蠢誤判，讓全隊失望。 / 為了贏得比賽，他竟然提出了一個蠢主意，讓隊友們感到困惑。,vs-adj,蠢蛋 / 蠢事 / 蠢人 / 蠢話 / 非常蠢 / 蠢得要命 / 蠢得不得了 / 蠢極了 / 蠢行 / 蠢動
410,完全。[例]這次的不愉快，純粹是他的固執所造成的。,純粹,Complete; indicating that something is unadulterated or absolute.,完全不掺杂其他因素。,他這次幫忙純粹是出於好心，沒有其他意圖。 / 他喜歡這個地方純粹是因為這裡的風景美麗。 / 我對這份工作的投入純粹來自於對藝術的熱愛。 / 他們的友誼純粹不像其他人一般掺杂利益的考量。 / 我選擇這本書純粹是想了解更多關於歷史的知識。 / 她的微笑純粹是表達她此刻的快樂，沒有任何掩飾。 / 我們的討論純粹是為了探索這個議題的深度和廣度。 / 他對待這件事情的態度純粹是出於對真相的渴望。 / 她追求寫作的興趣純粹是希望能夠表達自己的想法。 / 我們今天的聚會純粹是想享受彼此的陪伴，沒有其他安排。 / 他對於自然的熱愛純粹是因為那裡讓他感到平靜和自在。,adv,純粹的心意 / 純粹的快樂 / 純粹的感情 / 純粹的幸福 / 純粹的友誼 / 純粹的熱情 / 純粹的思想 / 純粹的追求 / 純粹的娛樂 / 純粹的善良
411,心地純一清淨，沒有邪惡的念頭。[例]我們應該常保純潔的赤子之心。,純潔,Pure and innocent; free from evil thoughts or malice.,心地純一清淨，沒有邪惡的念頭。,她對世界的好奇心讓她保有一顆純潔的心，即使面對困難也不會改變。 / 這首歌描寫了孩童純潔的愛，讓人聽了心中感到溫暖。 / 在這個充滿誘惑的社會中，能保持純潔的理想是非常難能可貴的。 / 我們應該珍惜彼此之間純潔的友誼，不讓誤會破壞這份情感。 / 純潔的心靈能夠識別真善美，讓我們在繁雜中找到平靜。 / 他們之間的純潔友誼，讓人感受到真摯的情感和無私的支持。 / 在童話故事中，純潔的角色往往能戰勝邪惡，迎來美好的結局。 / 儘管生活中充滿挑戰，但他依然堅持追求純潔的夢想，不輕言放棄。 / 這幅畫展現了少女純潔的心境，使觀者感受到一種清新的氣息。 / 純潔的愛情不需要華麗的表現，平凡的陪伴才是最珍貴的承諾。 / 重拾那段純潔的回憶，讓我感受到曾經無憂無慮的快樂時光。,n,一顆純潔的心 / 純潔的赤子之心 / 心靈純潔 / 保持純潔 / 純潔的思想 / 純潔的愛 / 純潔的感情 / 純潔的靈魂 / 追求純潔 / 珍惜純潔
412,純粹、潔淨。[例]這山中的泉水十分純淨甜美。,純淨,Pure and clean; free from impurities or contaminants.,純粹而且潔淨。,這片森林裡的空氣十分純淨，讓人感到心旷神怡。 / 他喜歡在安靜的湖邊冥想，享受這裡的純淨美好。 / 為了保護環境，我們應該努力維持水源的純淨。 / 在繁忙的都市生活中，尋找純淨的自然景觀成為了許多人的夢想。 / 他的音樂風格清新純淨，讓聽眾忘卻煩惱，感受到平靜。 / 聽著那首純淨的鋼琴曲，她的心中充滿了感動與安慰。 / 這個小鎮的夜空格外純淨，星星閃爍得讓人心醉。 / 追求純淨的生活，讓他遠離了喧囂與繁忙。 / 他常常在野外遠足，欣賞大自然的純淨與壯麗。 / 這幅畫展現了自然的純淨，讓觀者感受到一種心靈的洗滌。 / 一滴純淨的水，能夠喚醒人對大自然的珍惜與感恩。,vs-adj,一滴純淨的水 / 純淨的空氣 / 純淨的水源 / 心靈純淨 / 大自然的純淨 / 追求純淨的生活 / 感受到純淨的美好 / 維持純淨的環境 / 內心的純淨 / 擁有純淨的心靈
413,純潔真摯。[例]憶起過往，大家最懷念還是學生時期的純真歲月。,純真,Pure and sincere; characterized by innocence and integrity.,心地純潔而真摯，通常指人性或情感。,當我回想起童年時光，心中充滿了對那份純真的懷念。 / 在那個沒有科技產品的年代，大家都享受著與朋友一起玩耍的純真樂趣。 / 對他來說，純真的友情比任何奢華的享受都要來得珍貴。 / 她常說，生活中即使充滿挑戰，也不應該失去對未來的純真期待。 / 他在畫作中努力表達出那種難以言喻的純真情感。 / 我們都希望能夠在忙碌的生活中，保留一份屬於自己的純真。 / 在這個快節奏的社會裡，許多人依然渴望重拾那份無憂無慮的純真。 / 隨著年齡的增長，我越發珍惜那些陪伴我度過純真歲月的朋友。 / 每當我看到孩子們的笑容，心中就會湧起對純真時光的深深眷戀。 / 這本書讓我重新體驗到那種純真無邪的愛情故事，讓人感動不已。 / 在歲月的流逝中，我始終相信，純真的心靈能夠抵抗世俗的誘惑。,n,童年的純真 / 懷念純真 / 單純的純真 / 保持純真 / 回憶的純真 / 深深懷念純真 / 美好的純真 / 心靈的純真 / 伴隨純真 / 總是渴望純真
414,圖章、印記。[例]郵戳、戳記,戳,"A stamp or mark, such as a postal cancellation or seal.",印在某物上的圖案或標記。,我昨天收到一封國際包裹，裡面有美國郵戳和中國郵戳。 / 郵局的工作人員幫我的信件蓋上了郵戳，以表示已經寄出。 / 她在旅遊時收集各國的郵戳，這成為她的興趣之一。 / 那本舊書的扉頁上有一個古老的圖書館戳，讓它看起來更加珍貴。 / 在郵件上看到對方的郵戳，我才知道這封信已經寄出兩週了。 / 我為我的明信片蓋上了可愛的小郵戳，讓它看起來更加特別。 / 當我收到那封信時，郵戳上顯示的日期讓我感到驚訝，原來它已經遲到了一個月。 / 他們在包裹上貼了特製的郵戳，以確保運送過程中的安全和有效性。 / 收集不同城市的郵戳成為了我的一個小目標，這讓我的旅行更加有趣。 / 每當我看到那些獨特的郵戳，就不禁想起寄信時的美好回憶。 / 我把那張舊明信片的郵戳放大，想要更詳細地欣賞它的設計和顏色。,n,郵戳 / 戳記 / 進口戳 / 銷售戳 / 官方戳 / 合格的戳 / 包裹上的戳 / 簽收的戳 / 國際郵戳 / 約會的戳
414,以長條形物體尖端觸刺。[例]戳破、戳個洞　◎,戳,To stab or pierce with a pointed object.,以長條形物體的尖端觸刺某物。,小朋友在派對上戳破了好幾個氣球，房間裡瞬間充滿了笑聲。 / 我不小心戳到手指，流了一點血。 / 他用一根尖銳的筆戳了紙，竟然留下一個小洞。 / 當我戳到膝蓋的時候，忍不住大喊了一聲。 / 如果你過於用力地戳壞了玩具，那就沒辦法再修好了。 / 她不小心在氫氣球上戳了一個洞，瞬間變得無比安靜。 / 我用針戳了布料，想要做一個新的刺繡圖案。 / 那隻貓咪好奇地戳了戳我的鞋子，似乎在尋找什麼有趣的東西。 / 在溪邊，我們用樹枝輕輕戳水，激起一圈圈的小波紋。 / 他試著用手指戳了戳那個堅硬的果實，卻沒能將它弄開。 / 她小心翼翼地戳開包裝，裡面居然藏著一個驚喜的禮物。,va-t,戳破[氣球] / 戳個[洞] / 戳破[紙] / 戳[手指] / 戳一下[膝蓋] / 戳出[印記] / 戳壞[玩具] / 輕輕地戳[人] / 戳到[耳朵] / 用針戳[布]
415,外號，本名之外另取的名號。[例]同學相處，不宜隨意給人取綽號。,綽號,"A nickname; an informal name given to someone, usually based on their characteristics or behavior.",外號是指在本名之外，另行取的名字。,在學校，許多人都給彼此取了綽號，讓同學之間的關係更親近。 / 有些綽號是根據人的外貌來取的，像是「大眼睛」或「矮子」。 / 雖然他的本名很好聽，但大家還是習慣叫他那個搞笑的綽號。 / 有時候，綽號的由來會讓你感到意外，尤其是當你知道背後的故事時。 / 不同的圈子裡，為同一個人取的綽號可能完全不同，這也顯示了友誼的多樣性。 / 綽號可以反映一個人的個性，比如那些特別活潑的人經常會有很有趣的綽號。 / 有名的綽號往往會隨著時間流逝而改變，反映出人們對這個人的不同看法。 / 給人取綽號的時候，最好考慮對方的感受，避免讓人感到不舒服。 / 老師們也有自己的綽號，這讓學生們覺得他們更接地氣。 / 綽號有時候會成為一種身份的象徵，讓人們在群體中更容易被認出。 / 不少運動員因為在比賽中表現突出，而獲得了令人難忘的綽號，這也成為他們的一部分。,n,一個綽號 / 綽號的由來 / 有名的綽號 / 常用的綽號 / 大家叫他綽號 / 給人取綽號 / 不喜歡這個綽號 / 自己的綽號 / 好玩的綽號 / 綽號的意義
416,陰性、母的。與「雄」相對。[例]雌雄、雌蕊、雌兔,雌,Feminine; relating to female or motherhood.,陰性、母的，與「雄」相對。,農場裡有一隻雌鴨正在帶領小鴨子們學習游泳。 / 在動物園裡，遊客們特別喜歡觀察雌獅與幼獅的互動。 / 科學家研究雌性動物的行為，以了解牠們在群體中的角色。 / 雌花是植物繁殖的重要部分，沒有雌花就無法結出果實。 / 在這片森林裡，雌鹿常常帶著小鹿在樹間遊玩。 / 這隻雌貓叫做小黑，牠非常喜歡在窗邊曬太陽。 / 飼養員發現這隻雌兔十分活潑，總是跳來跳去，吸引了大家的注意。 / 在海洋裡，雌海豚會用特殊的聲音與幼崽溝通，確保牠們的安全。 / 學校的科學課上，老師講解了雌性昆蟲如何進行繁殖和生活。 / 當秋天來臨時，雌鳥們開始尋找適合的地方築巢，以便孵化蛋。 / 最近，動物保護組織發現了一隻受傷的雌狐狸，牠正急須得到醫療救助。,n,雌性 / 雌鳥 / 雌兔 / 雌花 / 雌鹿 / 雌性荷爾蒙 / 雄雌 / 一隻雌雞 / 雌蝴蝶 / 雌貓
417,仁慈且富有愛心。多指長輩對晚輩的愛而言。[例]母親的慈愛溫暖著每個孩子的心房。,慈愛,"Compassionate and affectionate; showing kindness and love, especially from elders to younger individuals.",仁慈且富有愛心，通常指長輩對晚輩的愛。,母親的慈愛如同陽光，溫暖著孩子們的心。 / 在這個充滿挑戰的世界裡，親友的慈愛是最大的支持。 / 小狗依偎在老人的腿旁，彷彿感受到他慈愛的氣息。 / 從父母的眼中，我看見了無條件的慈愛和期待。 / 即使在嚴厲的教導中，老師的慈愛也讓學生感到安心。 / 慈愛的祖母每天為我們準備美味的餐點，讓家充滿溫馨。 / 每當我遇到困難，朋友的慈愛總能給我力量繼續前行。  / 隨著時間的推移，我愈發珍惜那段充滿慈愛的童年時光。  / 在醫院裡，護士的慈愛關懷讓病人感到不再孤獨。  / 即使與我分隔兩地，母親的慈愛仍然陪伴著我，讓我倍感力量。  / 孩子們在公園裡嬉戲，周圍的每一位長輩都流露出慈愛的微笑。,n,母親的慈愛 / 父母的慈愛 / 家庭的慈愛 / 慈愛的關懷 / 祖父母的慈愛 / 慈愛的笑容 / 曹護個的慈愛 / 充滿慈愛 / 感受慈愛 / 慈愛常在
