word,number,old_definition,translation,definition,example_sentences,part_of_speech,collocations,pinyin,zhuyin,problematic_words
歡欣,5253,歡樂喜悅。《荀子．禮論》：「故人之歡欣和合之時，則夫忠臣孝子亦愅詭而有所至矣。」《後漢書．卷二七．杜林傳》：「海內歡欣，人懷寬德。」,Joyful and delighted; characterized by happiness and pleasure.,心中感到快樂和喜悅。,在農村的豐收季節，村民們一起慶祝，歡欣的氛圍洋溢在每個角落。 / 每當她收到親友的寄來的信，心中都感到無比歡欣與感動。 / 在母親生日那天，家人們準備了驚喜派對，母親看到蛋糕時歡欣不已。 / 當她聽到自己的作品獲得比賽獎項的消息，心中充滿了歡欣和驕傲。 / 看到小狗學會新把戲，孩子們興奮地圍著它，臉上洋溢著歡欣的笑容。 / 在婚禮上，新人的親友們隨著音樂舞動，現場瀰漫著歡欣與祝福的氛圍。,n,歡欣鼓舞 / 歡欣的笑聲 / 歡欣的氛圍 / 歡欣的時刻 / 歡欣的表情 / 令人歡欣的消息,huānxīn,ㄏㄨㄢ ㄒㄧㄣ,
歡欣鼓舞,5254,形容非常歡樂興奮。[例]我國青棒隊獲得世界冠軍的消息傳來，全國上下莫不歡欣鼓舞。,Extremely joyful and excited; used to describe a state of great happiness and enthusiasm.,形容非常歡樂興奮。,看到好久不見的好友回來，大家歡欣鼓舞，笑聲不斷。 / 知道自己考試成績優異，她欣喜若狂，心中充滿了歡欣鼓舞的感受。 / 每當學校舉辦運動會，學生們都以最好的表現來爭取榮譽，讓全校師生感到歡欣鼓舞。 / 在春節期間，家人團聚在一起，共享美好時光，大家的心中都洋溢著歡欣鼓舞的氛圍。 / 每年慶祝母親節時，孩子們精心準備驚喜，讓母親感受到無比的愛與歡欣鼓舞。 / 朋友們一起參加音樂節，隨著旋律共舞，彼此的心情都沉浸在歡欣鼓舞的氛圍中。,idiom,大家歡欣鼓舞 / 心情歡欣鼓舞 / 令我歡欣鼓舞 / 感到歡欣鼓舞 / 讓人歡欣鼓舞 / 每個人都歡欣鼓舞,huānxīn gǔwǔ,ㄏㄨㄢ ㄒㄧㄣ ㄍㄨˇ ㄨˇ,"校, 友, 師"
豢養,5255,飼養。比喻以利益收買人，供其驅使利用。例]豢養牛羊,"To raise or feed animals; to cultivate or provide for. Metaphorically, it means to buy off people with benefits, allowing them to be controlled or utilized.",飼養動物，使其生活並成長。比喻用利益收買人，以便隨意使用。,經商的人豢養了一批信徒，以便在市場上獲得更多的優勢。 / 某些政治勢力通過豢養媒體，來控制輿論，維護自己的權力。 / 這個宗教的領袖通過豢養信徒，以確保他的教義能在社區中繼續傳播。 / 他對自己的狗非常好，幾乎把它豢養成了家裡的小寶貝。 / 歷史上，許多王朝都通過豢養騎兵，來鞏固自己的統治。 / 許多藝術家選擇豢養信徒，因為他们是支持創作的重要力量。,va-t,豢養牛羊 / 豢養子弟 / 豢養人才 / 豢養成員 / 豢養手下 / 豢養信徒,huànyǎng,ㄏㄨㄢˋㄧㄤˇ,"騎兵, 乎"
幻影,5256,虛幻而不真實的影像。[例]一場大火，使他多年來開創的事業，在一夕之間成為幻影。,A phantom; an illusory image that is not real.,虛幻而不真實的影像。,追逐金錢的幻影，讓許多人失去了真正的幸福。 / 在海邊的黃昏，夕陽的倒影彷彿成了一道幻影，讓人感到神秘而遙遠。 / 他總是沉醉於過去的幻影中，無法面對現實的生活。 / 他在追尋成功的幻影，最終卻忽略了身邊真正重要的人。 / 每當夜晚降臨，城市的燈光如同幻影般閃爍，讓人迷失於其中。 / 在她的心中，那段回憶宛如一場幻影，時而清晰，時而模糊。,n,一場幻影 / 現實中的幻影 / 追逐幻影 / 消失的幻影 / 眼前的幻影 / 幻影似真,huànyǐng,ㄏㄨㄢˋㄧㄥˇ,
歡愉,5257,歡樂愉快。[例]每到農作物豐收的季節，整個農村便呈現出一片歡愉的景象。,Joyful and cheerful; reflecting happiness and delight.,歡樂愉快的心情。,在陽光明媚的日子裡，朋友們一起野餐，享受著歡愉的時光。 / 孩子們在遊樂場的嬉戲聲中，傳遞出無限的歡愉與快樂。 / 音樂會的現場充滿了熱情與歡愉，觀眾們隨著旋律一起歌唱。 / 在學校的運動會上，學生們不僅競爭激烈，還在比賽中享受到無窮的歡愉。 / 這次旅遊的經歷，讓我領悟到探索與發現所帶來的真正歡愉。 / 在咖啡廳裡，朋友們分享各自的故事，彼此之間充滿了溫暖和歡愉。,n,歡愉的時光 / 歡愉的笑聲 / 歡愉的氛圍 / 感到歡愉 / 帶來歡愉 / 共享歡愉,huānyú,ㄏㄨㄢˉㄩˊ,
還原,5258,恢復事物原來的樣子或位置。[例]取用書架上的圖書後，敬請還原。,To restore something to its original state or position.,恢復事物原來的樣子或位置。,影片編輯完成後，工作人員需要還原原始素材，以便查看最初的效果。 / 如果您的電腦出現問題，可能需要還原系統到先前的恢復點。 / 在博物館調整展品的擺放時，必須小心還原每一件藝術品的原貌，以保持歷史的真實性。 / 在清理完戶外活動後，參加者應該將場地還原，確保不影響自然環境。 / 當藝術家修復畫作時，必須仔細還原每一個細節，以保留作品的原有風格。 / 在進行數據分析之前，研究員需要將資料還原到原始格式，以確保分析的準確性。,vp-t,還原原貌 / 還原狀態 / 還原功能 / 還原內容 / 還原系統 / 還原場地,hái yuán,ㄏㄞˊ ㄩㄢˊ,展
荒誕,5259,荒唐虛妄。[例]荒誕不經,Absurd; wildly unreasonable or fictitious.,荒唐且不真實，與實際情況相差甚遠。,有時候，政治家的言論聽起來真的很荒誕，讓人懷疑他們的判斷力。 / 荒誕可笑的現象在社會上層出不窮，令人不禁思考人類的行為到底出了什麼問題。 / 在社交媒體上，常常出現一些荒誕的挑戰，讓人不禁懷疑大家的創意到底有多極限。 / 荒誕的現實情況讓我們感到震驚，明明是應該遵循的規則卻被隨意扭曲。 / 在這次辯論中，他提出的荒誕觀點完全偏離了主題，讓其他人都無法接續討論。 / 荒誕的行為在這個城市越來越普遍，讓人對人際關係的真實性產生了懷疑。,vs-adj,荒誕的說法 / 荒誕的想法 / 荒誕的行為 / 荒誕的理論 / 荒誕的故事 / 荒誕可笑,huāngdàn,ㄏㄨㄤˉㄉㄢˋ,
荒地,5260,未經開墾或已經荒蕪的土地。[例]政府打算將這塊荒地開闢成新型的遊樂區，供作民眾休閒娛樂場所。,Uncultivated or wasteland; land that has not been plowed or is in a state of neglect.,未經過開墾或已經荒蕪的土地。,這片原本被遺忘的荒地，經過社區的努力，終於成為了一個美麗的公園。 / 這塊荒地上長滿了雜草，顯示出多年的荒廢與忽視。 / 他們計畫在這片荒地上建造新的住宅區，以滿足日益增加的人口需求。 / 經過幾年的努力，這片曾經廢棄的荒地已經變成了一個生態保護區。 / 這些年來，漁民們發現附近的荒地對於恢復海洋生態系統至關重要。 / 在環保組織的推動下，這片幾年未耕作的荒地被轉變為一個社會實驗區，探索可持續發展的可能性。,n,廢棄的荒地 / 無法利用的荒地 / 廣大的荒地 / 改造荒地 / 荒地的治理 / 荒地的利用,huāngdì,ㄏㄨㄤˉㄉㄧˋ,轉變為
黃豆,5261,植物名。豆科黃大豆屬，一年生草本。三出複葉，卵圓形。夏季開紫紅色或白色蝶形花。莢果有短柄，扁平線狀長橢圓形，上有剛毛。果內藏有種子，種皮以黃、綠、黑色最常見。可製成豆腐、醬油或榨油以供食用。[例]大豆榨油後的渣可充作肥料和家畜的飼料。　△黃豆,"A soybean; a type of legume plant in the family Fabaceae, with large seeds that are typically yellow, green, or black, used to make tofu, soy sauce, and oil.",植物名，屬於豆科黃大豆屬，一年生草本。葉子為三出複葉，形狀卵圓。夏季開紫紅色或白色的蝴蝶形狀的花。莢果有短柄，扁平線狀長橢圓形，上有剛毛。果內藏有種子，種皮以黃、綠、黑色最常見。可製成豆腐、醬油或榨油可食用。,我們可以用黃豆製作豆漿和豆腐。 / 在市場上，新鮮的黃豆十分受歡迎，因為它們是許多料理的主要食材。 / 黃豆有豐富的蛋白質，非常適合素食者作為肉類的替代品。 / 傳統的中國料理中，黃豆經常製成醬油，提升菜餚的風味。 / 黃豆的生長期約為三個月，這使得它成為效率較高的作物選擇。 / 黃豆的多樣用途讓它成為許多國家飲食文化中不可或缺的一部分。,n,黃豆製品 / 黃豆豆腐 / 黃豆粉 / 黃豆油 / 新鮮的黃豆 / 黃豆的用途,huángdòu,ㄏㄨㄤˊ ㄉㄡˋ,"果, 扁平線, 黃大豆, 豆科, 藏有, 紫紅, 榨, 生長期, 莢, 黃綠, 複葉"
皇宮,5262,君王居住的宮殿。[例]這棟大廈建造得像皇宮一樣富麗堂皇。,A palace where a monarch resides.,國王居住的宮殿，通常建造得非常富麗堂皇。,這座歷史悠久的皇宮裡，有許多珍貴的藝術品和文物。 / 皇宮的牆壁上雕刻著許多小故事，讓人們感受到往昔的輝煌。 / 在皇宮的大廳裡，舉行著盛大的舞會，所有的貴族都盛裝出席。 / 孩子們在導遊的帶領下，興奮地參觀著皇宮裡的每一個角落。 / 皇宮的花園裡，四季交替，讓每一位走進此地的人都能享受到大自然的美好。 / 參觀完皇宮後，觀光客們紛紛在紀念品店裡挑選與皇宮相關的紀念品帶回家。,n,華麗的皇宮 / 歷史悠久的皇宮 / 進入皇宮 / 修建皇宮 / 參觀皇宮 / 皇宮的寶物,huánggōng,ㄏㄨㄤˊㄍㄨㄥ,"走進, 帶回"
黃瓜,5263,胡瓜的別名。參見「胡瓜」條。,A cucumber; a type of vegetable commonly used in salads and dishes.,胡瓜的別名。,在我的家鄉，黃瓜經常被用來做家庭聚餐的配菜。 / 這道料理的秘訣就是加入新鮮的黃瓜，使味道更加清爽。 / 黃瓜的清香搭配上其他蔬菜，讓這道沙拉更加美味。 / 每當我們野餐時，黃瓜都是不可少的食材之一。 / 爸爸常常說，吃黃瓜對皮膚有好處，讓我們多多嘗試各種做法。 / 我今天學會了如何製作黃瓜泡菜，味道酸辣可口，非常開胃。,n,新鮮的黃瓜 / 黃瓜沙拉 / 黃瓜炒蛋 / 黃瓜的營養 / 腌黃瓜 / 黃瓜片,huángguā,ㄏㄨㄤˊㄍㄨㄚ,"胡瓜, 瓜, 蛋黃, 腌"
皇冠,5264,君王所戴的頭冠。[例]猴子戴上皇冠的樣子，看起來很滑稽。,A crown worn by a monarch.,王所戴的頭冠，通常由金、銀或寶石製成，象徵權力與地位。,城堡裡的皇冠的光芒，吸引了所有人的目光。 / 每位國王登基時，都會接受象徵權力的皇冠。 / 在故事書中，皇冠常常代表著冒險和榮耀的旅程。 / 這部電影中的反派角色，居然也擁有一頂黑暗的皇冠，象徵著邪惡的權力。 / 在夢中，她發現自己戴上了一頂魔法皇冠，能夠實現所有的願望。 / 國王的皇冠不僅象徵著地位，還承載著無數的責任與使命。,n,皇冠的光芒 / 皇冠的重量 / 皇室的皇冠 / 珍貴的皇冠 / 皇冠上的寶石 / 代表的皇冠,huángguàn,ㄏㄨㄤˊㄍㄨㄢˋ,金銀
皇家,5265,皇帝的家族。[例]她身為皇家的一員，卻和百姓打成一片，絲毫沒有驕矜之氣。,Relating to the imperial family; of or belonging to the royal family.,與皇帝有關的家族。,皇家文化的傳承對於一個國家的歷史意義重大。 / 這座宮殿展示了皇家生活的奢華與繁華。 / 她的畫作受到皇家藝術機構的讚譽，展現了高超的技巧。 / 皇家成員經常參加各種社交活動，增進與國際的交流。 / 皇家血統的象徵意義讓許多人對這個家族充滿敬仰。 / 皇家婚禮吸引了全球媒體的關注，成為當年的熱門話題。,n,皇家婚禮 / 皇家成員 / 皇家血統 / 皇家歷史 / 皇家榮譽 / 皇家典禮,huángjiā,ㄏㄨㄤˊㄐㄧㄚ,
惶恐,5266,恐懼不安的樣子。[例]總經理交給我這個重責大任，實在令我感到惶恐。,Anxious and fearful; showing signs of fear and unease.,心中充滿恐懼與不安。,聽到他們的批評，我心中感到惶恐，不知道自己該如何改進。 / 老師突然點名，我惶恐地掏出課本，希望自己能答對問題。 / 她收到重要任務的通知，心中惶恐不已，擔心自己無法完成。 / 當我看到報紙上的不幸消息時，心中惶恐，擔心身邊的人是否安全。 / 當聽到即將面臨的變動時，我感到一陣惶恐，對未來的不確定性感到不安。 / 面對嚴峻的競爭環境，公司的每位員工都感到惶恐，努力提升自己的專業能力。,vs-i,感到惶恐 / 心中惶恐 / 惶恐不安 / 表情惶恐 / 惶恐的樣子 / 不由得惶恐,huángkǒng,ㄏㄨㄤˊㄎㄨㄥˇ,安
遑論,5267,不必說、不用再說。[例]連這點小事都做不好，遑論要成大功、立大業了。,"Not to mention; An expression indicating that something is already obvious or accepted, implying that there is no need to elaborate further.",不必再提或說的情況，通常用來強調某件事更不可能或更不需要。,他連基本的規則都搞不清楚，遑論進一步的複雜操作。 / 如果連簡單的溝通都無法達成，遑論建立深入的合作關係。 / 他對這個專業知識一無所知，遑論能夠應用到實際的工作中。 / 我們連初步的資料都還沒整理完，遑論進行詳細的分析。 / 這項任務的困難程度遠超出他的能力範圍，遑論細節上的處理。 / 即使只是基本的要求，他也無法達成，更遑論面對更複雜的挑戰。,idiom,遑論小事 / 遑論細節 / 遑論負責 / 遑論進一步 / 遑論進行 / 遑論更加複雜的情況,huánglùn,ㄏㄨㄤˊㄌㄨㄣˋ,
荒山,5268,人跡罕至的山。如：「荒山野地」。《三國演義》第三一回：「軍行之次，夜宿荒山。」,A desolate mountain; a mountain rarely visited by people.,人跡稀少的山。,在這座荒山中，昆蟲的叫聲讓人感受到生命的存在 / 荒山的迷人景色，讓畫家們不斷創作出新作品。 / 聲音穿越過荒山的邊界後，只剩下微弱的回音 / 附近的荒山總是吸引著喜愛探險的人們前來挑戰。 / 迷失在荒山中，他感受到前所未有的孤獨與安靜。 / 每當夕陽西下，荒山的輪廓變得格外迷人，令人陶醉。,n,住在荒山間 / 荒山的風景 / 荒山的景色 / 荒山的寂靜 / 漫步在荒山上 / 迷失在荒山中,huāngshān,ㄏㄨㄤˉㄕㄢ,
皇上,5269,古代臣民對皇帝的尊稱。[例]古代百姓心目中的皇上，具有絕對的權威。,A term of respect used by subjects to refer to the emperor in ancient China.,古代大臣與人民對皇帝的尊稱，表示對其權威的敬重。,在古代，皇上對於國家的每一個決策都影響著百姓的生活。 / 有時候，皇上也會派遣大臣前去地方視察，了解民間疾苦。 / 「皇上」這個稱呼不僅代表權力，還承載著古老中國的文化傳承。 / 為了保衛國家，皇上經常召集文武官員討論軍事策略。 / 皇上的命令如同天條，任何人不得違抗。 / 皇上對於文學藝術的支持，使得當時的文化繁榮發展。,n,皇上的權威 / 皇上的命令 / 皇上之位 / 皇上的寶座 / 皇上之令 / 皇上與百姓,huángshàng,ㄏㄨㄤˊㄕㄤˋ,
皇室,5270,皇帝的家族。[例]中國有許多朝代都因皇室內亂而滅亡。,The royal family; the family of the emperor.,指的是皇帝的家族，包括皇帝的直系親人和其他成員。,在皇室的婚禮上，出現了許多傳統的儀式和習俗。 / 皇室的歷史可以追溯到幾個世紀以前，影響了這個國家的文化。 / 皇室成員的生活常常受到媒體的高度關注，成為公眾話題。 / 在皇室的正式活動中，常常可以看到盛大而華麗的服裝。 / 皇室的慈善活動不僅提升了其形象，也幫助了許多需要幫助的人。 / 儘管時代變遷，皇室依然在國家中扮演著重要的象徵角色。,n,皇室成員 / 皇室血統 / 皇室後裔 / 皇室財產 / 皇室婚姻 / 皇室代表,huángshì,ㄏㄨㄤˊㄕˋ,
皇太后,5271,皇帝的母親。《漢書．卷八二．王商傳》：「先是皇太后嘗詔問商女，欲以備後宮。」,The empress dowager; the mother of the emperor.,皇帝的母親，位居皇后之上，通常掌握權力。,皇太后在宮中擁有至高無上的權力，對朝政有著重要影響。 / 在每年的祭天儀式上，皇太后都會親自主持，表示對祖先的尊敬。 / 皇太后與皇帝之間的關係十分密切，常常一同討論國家政治。 / 在朝廷上，皇太后發表意見時，所有大臣都必須恭敬聆聽，無不緊張。 / 皇太后曾經醫治過一位重病的官員，讓他感激不已，立刻前往奉獻千金。 / 皇太后會問皇帝有關國家的重要決策，並提出她的看法。,n,皇太后的權力 / 皇太后的地位 / 皇太后的威嚴 / 皇太后的想法 / 皇太后與皇帝 / 皇太后與妃子,huángtàihòu,ㄏㄨㄤˊ ㄊㄞˋ ㄏㄡˋ,"皇, 宮, 妃子"
荒蕪,5272,土地因無人管理而雜草叢生。[例]由於人口大量外移，使得這裡大部分的田園都荒蕪了。,Wild and overgrown; referring to land that is neglected and covered with weeds due to lack of management.,土地因無人管理而到處都是雜草，顯得荒廢沒有用處。,當地居民無法維持生計，導致許多曾經繁榮的村莊變得荒蕪，留下一片空蕩蕩的景象。 / 在這幅畫中，藝術家捕捉了荒蕪的草地上孤獨小屋的景象，讓人感受到一種淒涼的美。 / 當我回到故鄉時，曾經充滿生機的田園已經荒蕪，讓我感到心痛不已。 / 在這片荒蕪的土地上，曾經繁茂的樹木如今都看不到了，寂靜得讓人不忍直視。 / 過去這裡是人們勤勉耕作的地方，如今卻因為長年的乾旱而變得荒蕪，失去了往日的生機。 / 荒蕪的風景中，隱約可見昔日的繁榮，讓人不禁思考人類活動對土地的影響。,va-i,荒蕪的土地 / 荒蕪的田園 / 一片荒蕪 / 荒蕪的景象 / 荒蕪的草地 / 變得荒蕪,huāngwú,ㄏㄨㄤ ㄨˊ,
晦暗,5273,昏暗、陰沉。[例]頃刻間，烏雲密布，天色一片晦暗。,Dim and overcast; describing a state of low light and gloominess.,昏暗而陰沉。,天色逐漸變得晦暗，似乎快要下雨了。 / 晦暗的光線讓畫作顯得更加神秘。 / 在晦暗的角落裡，有一個人靜靜地坐著，似乎在思考人生的困惑。 / 心情晦暗的他，走在街上沒有目的地盡情發洩自己的情感。 / 友人聚會的氣氛有些晦暗，大家都沉默不語，似乎心中各有心事。 / 晦暗的未來讓他感到焦慮，但他依然努力尋找希望的光芒。,vs-i,晦暗的角落 / 晦暗的光線 / 心情晦暗 / 晦暗的未來 / 天色晦暗 / 晦暗的色調,huì'àn,ㄏㄨㄟˋㄢˋ,
彙編,5274,把文章、資料等彙集、編纂成冊。[例]這次學術研討會所發表的論文及討論內容，將由主辦單位彙編出版。,"To compile and edit a collection of articles, data, etc.",將文章、資料等收集起來並編纂成冊。,為了保存重要的歷史資料，圖書館每年都會彙編一份珍藏的文獻集。 / 這本書是多年來研究成果的彙編，對於學術界具有重要意義。 / 在學校的專題報告中，學生們需要彙編相關資料，來支持他們的論點。 / 為了促進知識的交流，經常會有專家針對特定主題彙編出各類研究資料。 / 這本作品彙編不僅包含詩歌，還有許多小說，十分豐富。 / 今年的科技大會後，組織方將彙編一份參與企業的報告，讓大家了解最新的創新動態。,va-t,學術的彙編 / 文獻彙編 / 作品彙編 / 經典的彙編 / 文章彙編 / 系列彙編,huìbiān,ㄏㄨㄟˋㄅㄧㄢ,
迴盪,5275,迴旋飄浮。[例]她嘹亮的歌聲在空曠的教室中迴盪。,To resonate or echo in a circular or prolonged manner.,聲音在空氣中來回旋轉，像是飄浮不定。,秋天的微風吹過，樹葉在空中迴盪，像是跳著優雅的舞蹈。 / 當她輕聲說話時，甜美的聲音在房間裡迴盪，使每個人都感到舒適和放鬆。 / 在山谷中，獵人的呼喊聲迴盪著，似乎連大自然也在聆聽他的召喚。 / 藍色的天空下，孩子們的笑聲迴盪，帶來無盡的快樂與純真。 / 在廣場上，愛國的演講迴盪著，激勵著每一位聽眾心中的情感。 / 無論走到哪裡，那段回憶都在我的心中迴盪，提醒我曾經的美好時光。,va-i,迴盪的回聲 / 迴盪的旋律 / 迴盪的歌聲 / 迴盪在空中 / 迴盪在耳邊 / 迴盪在腦海,huídàng,ㄏㄨㄟˊㄉㄤˋ,
悔改,5276,承認過錯並加以改正。[例]只要是真心悔改，不妨再給他一次機會。,To acknowledge wrongdoing and make amends.,承認過錯並加以改正。,認識到自己犯錯的時候，真心悔改是很重要的。 / 他過去的行為讓人失望，但只要他願意悔改，大家或許還是會給他機會。 / 我們希望每個人都能在犯錯後及時悔改，以免造成更大的傷害。 / 他的行為雖然讓人失望，但如果他能誠心悔改，大家還是願意原諒他。 / 悔改並不只是口頭上的承諾，更需要實際的行動來證明。 / 學校舉辦了一個悔改教育課程，希望能幫助學生認識到自己的錯誤並積極悔改。,va-t,真心悔改 / 誠心悔改 / 深刻悔改 / 悔改行為 / 主動悔改 / 及時悔改,huǐgǎi,ㄏㄨㄟˇㄍㄞˇ,
悔恨,5277,後悔怨恨。[例]當父親過世後，他才悔恨自己沒有盡到為人子女的責任。,Remorseful and resentful; expressing deep regret and bitterness over one's actions.,對自己過去的行為感到後悔和怨恨。,失去這段感情後，他終於明白自己過去的錯誤，心中充滿悔恨。 / 一個人如果不懂得從悔恨中學習，將來仍然會重複同樣的錯誤。 / 在她面對悔恨的時刻，才意識到曾經忽略的那些珍貴時光。 / 當她回想起自己對父母的冷漠態度時，心中不禁湧現出深深的悔恨。 / 每當看到曾經的朋友們都過得很好，他心底裡總是隱藏著一絲悔恨。 / 她在失去工作後，才真正體會到過去不努力的悔恨，心中充滿惋惜。,n,悔恨不已 / 感到悔恨 / 悔恨的時刻 / 面對悔恨 / 表達悔恨 / 充滿悔恨,huǐhèn,ㄏㄨㄟˇ ㄏㄣˋ,
毀壞,5278,毀損、破壞。[例]這棟建築物歷史悠久，多數建材都已因風雨的侵蝕而毀壞了。,To damage or destroy; to ruin.,損壞或破壞某物，使其不能正常使用或失去原有功能。,在這場自然災害中，許多城市的基礎設施遭受毀壞，造成交通極度不便。 / 長年缺乏保護的藝術館，部分畫作因潮濕而毀壞，無法完全修復。 / 光污染使天文觀測設備受到毀壞，科學研究面臨巨大挑戰。 / 在一場突如其來的火災中，圖書館內的珍貴書籍遭到毀壞，使得學術資源大幅減少。 / 政府已經啟動計畫，希望能修復那些因洪水而毀壞的房屋，幫助居民重建家園。 / 隨著氣候變遷，這片沿海地區經歷了多次海浪侵襲，導致生態系統嚴重毀壞。,vp-t,嚴重毀壞 / 遭受毀壞 / 造成毀壞 / 防止毀壞 / 避免毀壞 / 財產毀壞,huǐhuài,ㄏㄨㄟˇ ㄏㄨㄞˋ,
揮霍,5279,浪費而無節制。[例]他揮霍成性，不到一年，所有的家當都被他耗光了。,To squander or waste money or resources extravagantly.,浪費而不加節制，通常用於金錢或資源。,他出國旅遊時，總是隨意揮霍，讓朋友們感到驚訝。 / 她不喜歡省吃儉用，反而喜歡揮霍金錢，享受生活的每一刻。 / 朋友們提醒他，揮霍時間只會讓他後悔，應該更好地規劃生活。 / 在他的影響下，許多人都開始揮霍青春，無所事事浪費年華。 / 她常常揮霍無度，購買奢侈品，結果導致財務狀況非常緊張。 / 他的生活方式讓人擔憂，因為他總是隨意揮霍，沒有任何儲蓄計劃。,va-t,揮霍時間 / 揮霍財產 / 揮霍青春 / 隨意揮霍 / 揮霍無度 / 揮霍成性,huīhuò,ㄏㄨㄟ ㄏㄨㄛˋ,
匯集,5280,聚集。[例]這一帶為商賈匯集之地，相當繁華。,To gather or assemble in one place.,聚集在一起，形成一個大群體。,這部電影匯集了許多知名演員，使得票房表現相當亮眼。 / 這個音樂節匯集了不同風格的樂隊，讓觀眾享受到多元的音樂體驗。 / 網路平台匯集了大量的用戶評價，幫助消費者做出明智的購買決定。 / 在這次的國際論壇中，各國領袖匯集交流，尋求解決氣候變遷的方案。 / 在這個志願活動中，來自不同背景的人們匯集在一起，共同為社區服務。 / 文化的匯集使得這個城市在藝術和風俗上展現出獨特的魅力。,va-i,資源匯集 / 知識匯集 / 商業匯集 / 創意匯集 / 參與者匯集 / 需求的匯集,huìjí,ㄏㄨㄟˋㄐㄧˊ,
