word,number,old_definition,translation,definition,example_sentences,part_of_speech,collocations,pinyin,zhuyin,problematic_words
籌措,4258,設法籌募。[例]他絞盡腦汁籌措款項，期使這個計畫能付諸實行。,To raise or gather funds or resources through efforts or arrangements.,設法籌募資源或款項。,他的社區計畫需要大量資金維持運作，因此大家都在想辦法籌措經費。 / 這個研究項目非常重要，負責的團隊正在努力籌措各種所需的資源，以確保研究順利進行。 / 為了提升社區的福利，志工們積極籌措捐款，希望能夠建立一個新的活動中心。 / 這次環保活動受到廣泛關注，主辦方正在籌措資金，以便能夠覆蓋所有的宣傳和執行成本。 / 鑒於當前的經濟形勢，這些非營利組織必須靈活籌措經費，以確保他們的服務不會中斷。 / 社區希望改善公共安全，於是正積極籌措資金，用於購置更先進的監控設備。,va-t,籌措資金 / 籌措經費 / 籌措支持 / 籌措物資 / 籌措資源 / 籌措活動,chóucuò,ㄔㄡˊㄘㄨㄛˋ,"籌募, 科研, 鑒"
仇敵,4259,彼此間含有深刻怨恨而成敵對狀態的人。[例]自從交惡後，他們一直視對方為仇敵。,A deep-seated enemy; A person with whom one shares profound animosity.,彼此間含有深刻怨恨而成敵對狀態的人。,歷史上，許多國家因為領土爭端而成為世世代代的仇敵。 / 在這部電影中，主角不斷與自己的仇敵周旋，最終擊敗了惡勢力。 / 有些文學作品描寫了忠臣與仇敵之間的激烈鬥爭。 / 雖然他們曾經是好朋友，但因為利益衝突，最終卻變成了仇敵。 / 在這場戰爭中，曾經的盟友變成了仇敵，讓人感嘆人心難測。 / 在體育競賽中，選手之間的競爭有時會讓人感受到仇敵的氣氛。,n,仇敵之間 / 仇敵關係 / 與仇敵對抗 / 成為仇敵 / 千古仇敵 / 天生仇敵,qiú dí,ㄑㄧㄡˊ ㄉㄧˊ,"測, 世世代, 惡勢, 含有"
抽動,4260,肌肉一縮一伸的顫動。《老殘遊記二編》第八回：「你看，還沒有死透呢，手足還有抽動，是還知道痛呢！」,"To twitch or spasm in a jerking manner, characterized by rhythmic muscle contractions and relaxations.",肌肉一縮一伸的顫動。,他受了重傷，手指還在微微抽動，似乎還有知覺。 / 夜裡，我的腿經常抽動，可能是因為運動過度了。 / 醫生告訴我，這種肌肉抽動可能是由於缺乏鎂造成的。 / 醫生檢查後發現，他的肢體抽動可能與神經系統的問題有關。 / 有時候，我的指尖會突然抽動，這讓我無法專心工作。 / 這個小孩因為緊張而臉部抽動，老師安慰他，希望他能放鬆心情。,vp-i/N,肢體抽動 / 不自主抽動 / 突然抽動 / 明顯抽動 / 伴隨抽動 / 輕微抽動,chōudòng,ㄔㄡ ㄉㄨㄥˋ,"微, 重傷, 鎂, 指尖"
綢緞,4261,泛指絲織品。[例]綾羅綢緞,Silk fabrics; A general term for silk woven items.,泛指絲織品，通常光滑且有一定光澤。,他用綢緞包裝的禮物看起來十分精美。 / 她穿著一襲紅色的綢緞旗袍，令所有人驚艷不已。 / 這件綢緞的睡衣讓我每晚都能享受如雲般的柔軟與舒適。 / 綢緞的光澤感使整個房間顯得更加典雅奢華。 / 高級的綢緞衣服讓她在派對上成為眾人矚目的焦點。 / 這幅畫的畫框是用綢緞裱邊，增添了不少藝術氣息。,n,精美的綢緞 / 鮮豔的綢緞 / 綢緞的衣服 / 綢緞製的床單 / 滑順的綢緞 / 手工綢緞,chóuduàn,ㄔㄡˊㄉㄨㄢˋ,"旗袍, 裱, 如, 絲織, 感, 典雅, 畫框, 驚艷"
抽筋,4262,筋肉痙攣作痛。[例]感染破傷風會有抽筋的現象。,Muscle spasm; a painful condition characterized by involuntary contractions of muscles.,筋肉突然收縮，造成疼痛。,運動後沒有好好拉筋，導致他晚上腳抽筋，非常痛苦。 / 夜裡驚醒時，因為小腿抽筋，她忍不住叫了出來。 / 高強度訓練後，隊友們都開始抱怨腿部抽筋，他們意識到需要適當調整訓練計畫。 / 最近她經常抽筋，特別是在運動後，讓她感到很困擾。 / 朋友告訴我，晚上喝太多水可能會導致腿部抽筋。 / 每當參加高強度的舞蹈課程後，她都會感到小腿抽筋，於是開始尋找放鬆的方法。,n,抽筋的症狀 / 抽筋的原因 / 經常抽筋 / 頻繁抽筋 / 緩解抽筋 / 避免抽筋,chōujīn,ㄔㄡˉㄐㄧㄣ,"隊友, 出來"
愁苦,4263,憂愁苦悶。[例]生活的重擔常使他愁苦不堪。,Grief and sorrow; deep sadness and anguish resulting from worry or misery.,憂愁而且苦悶。,在家庭變故之後，她的生活充滿了愁苦，經常感到無助與孤獨。 / 雖然朋友們都在身邊，他卻依然無法擺脫心中的愁苦，感覺與世界隔絕。 / 他經常面臨生活的愁苦，讓他感到無比壓力和煩躁。 / 他試著用快樂來掩蓋內心的愁苦，但每當獨處時，這種悲傷便又湧上心頭。 / 在這個充滿競爭的社會中，許多人都在愁苦中尋找希望，渴望改變自己的命運。 / 生活的愁苦讓他變得更加成熟，雖然艱難，但也讓他更加珍惜身邊的人。,n,生活的愁苦 / 愁苦的心情 / 愁苦的日子 / 愁苦的思緒 / 深陷愁苦 / 愁苦的回憶,chóukǔ,ㄔㄡˊㄎㄨˇ,湧
酬勞,4264,給予出力人的報酬。[例]這份工作酬勞優渥，因此有不少人競爭。,Compensation or remuneration provided to those who exert effort.,給予出力人的報酬或報答，通常以金錢或其他形式回饋。,這份工作的酬勞非常高，因此許多人都想競爭這個名額。 / 前一陣子有一家公司推出了確保酬勞透明化的計畫，以提高員工的工作滿意度。 / 對於這項專案的酬勞，團隊成員們都感到非常滿意，因為他們花了不小的心力。 / 如果能夠提供合理的酬勞，就可以吸引到更多優秀的人才。 / 這份工作的酬勞必須和員工的表現掛鉤，這樣才能激勵大家更加努力。 / 社會對於藝人的酬勞話題一直都很關注，特別是一些知名明星的收入更是驚人。,n,高額酬勞 / 合理酬勞 / 優渥酬勞 / 每月酬勞 / 薪資酬勞 / 獎金酬勞,chóuláo,ㄔㄡˊㄌㄠˊ,掛鉤
愁眉苦臉,4265,眉頭緊皺，苦喪著臉。形容憂傷、愁苦的神色。[例]他最近為了龐大的債務而愁眉苦臉。,A frown and a sad face; showing deep sorrow and concern.,眉頭緊皺，苦喪著臉。形容憂傷、愁苦的神色。,他的父母最近為了工作不順而愁眉苦臉，讓他感到很心痛。 / 在面對學業壓力時，她總是愁眉苦臉，似乎找不到解決的辦法。 / 昨天的考試結果出來後，同學們愁眉苦臉，擔心自己的成績會影響升學。 / 最近公司裁員的消息傳來，許多員工愁眉苦臉，對未來感到不安。 / 運動隊在比賽中失利後，隊員們愁眉苦臉，感到失望和挫折。 / 每當想到即將到來的考試，他便愁眉苦臉，心中充滿了焦慮。,idiom,愁眉苦臉的樣子 / 愁眉苦臉的表情 / 愁眉苦臉的心情 / 愁眉苦臉的日子 / 愁眉苦臉的事情 / 愁眉苦臉的孩子,chóuméikǔliǎn,ㄔㄡˊㄇㄟˊㄎㄨˇㄌㄧㄢˇ,"出來, 喪"
稠密,4266,多而密。[例]這一帶交通方便，因此人口稠密。,Dense and numerous; referring to a high concentration or abundance of something.,多而密，形容事物分布得很近，通常用來描述人或物的集中程度。,這個地區的居民生活得很和諧，形成了稠密的社區網絡。 / 在熱帶雨林裡，植物的生長非常稠密，給動物提供了豐富的棲息地。 / 在城市的中心地帶，商店和餐館林立，讓這裡的人潮顯得格外稠密。 / 在這個節慶期間，參加慶祝活動的人數稠密，街道上充滿了歡聲笑語。 / 這片森林裡，動植物的種類稠密，形成了一個獨特的生態系統。 / 這座城市的人口稠密，使得公共交通系統面臨很大的壓力和挑戰。,vs-adj,人口稠密 / 交通稠密 / 人群稠密 / 觀眾稠密 / 動植物稠密 / 資源稠密,chóumì,ㄔㄡˊㄇㄧˋ,"動植, 雨林, 笑語, 歡"
臭氣,4267,難聞的氣味。[例]臭氣薰人、臭氣沖天,"A foul odor; an unpleasant and strong smell, often associated with decay or pollution.",難聞的氣味。,污水處理廠附近的臭氣讓路過的人都皺起了眉頭。 / 他們在清理倉庫時發現了一些發霉的箱子，裡面散發著一股令人難忍的臭氣。 / 凌晨的公園裡，一陣臭氣撲鼻而來，讓路過的行人無法忍受。 / 夜市的小吃攤旁，雖然有美味的食物，但也伴隨著一股奇怪的臭氣。 / 這家餐廳因為廚房的清潔問題，經常被客人抱怨臭氣熏人。 / 當地的工廠排放廢氣，導致附近的空氣中充滿了刺鼻的臭氣。,n,臭氣撲鼻 / 臭氣沖天 / 臭氣熏人 / 臭氣四散 / 臭氣難忍 / 臭氣滿屋,chòuqì,ㄔㄡˋㄑㄧˋ,"沖天, 廠, 污水, 熏, 刺鼻, 皺起"
籌錢,4268,,"To raise or gather money, often for a specific purpose or project.",籌錢是指為某個目的或者計劃，想辦法收集或準備所需的金錢。,這次的慈善活動，她提議用拍賣的方式來籌錢，大家都覺得不錯。 / 在籌錢的過程中，我們發現很多人願意捐款支持這個計畫。 / 籌錢的目的是為了改善當地學校的設施，希望能吸引更多的義工參與。 / 在這次社區活動中，大家一起想出各種創意的籌錢方法，希望能提高籌款的效果。 / 對於這個公益項目，籌錢的挑戰在於如何持續吸引公眾的關注和支持。 / 為了達成籌錢的目標，團隊決定定期舉辦社交活動，增強與潛在捐助者之間的聯繫。,va-t,籌錢方式 / 籌錢計劃 / 籌錢來源 / 籌錢目的 / 籌錢的過程 / 籌錢的技巧,chóuqián,ㄔㄡˊㄑㄧㄢˊ,"籌款, 捐助"
抽籤,4269,在神廟中抽取書有籤號的竹籤以卜吉凶。比喻難以決定時，為求公平而依人數做籤，用以抽取決定的方式。[例]這次的報名人數眾多，但參加的名額有限，所以將抽籤決定。,To draw lots; to select randomly by chance.,在神廟中抽取書有籤號的竹籤以卜吉凶。比喻難以決定時，為求公平而依人數做籤，用以抽取決定的方式。,這次的派對名額有限，主辦方決定先進行抽籤。 / 為了保證公平，這次的宿舍分配將採用抽籤的方式進行。 / 由於報名參加比賽的人太多，主辦方只能透過抽籤來決定最終參賽名單。 / 這次抽籤的結果讓許多人感到驚喜，沒想到自己會被選中。 / 為了避免爭議，運動會的參賽名額將通過抽籤來分配。 / 在購買熱門商品時，有時候也會使用抽籤來決定誰能拿到購買的機會。,va-t/N,抽籤結果 / 公平抽籤 / 抽籤參加者 / 進行抽籤 / 隨機抽籤 / 抽籤方式,chōuqiān,ㄔㄡ ㄑㄧㄢ,"籤, 吉凶, 參賽, 依"
抽取,4270,從中拿取、吸取。[例]抽取地下水會造成地層下陷。,To extract or draw out from a source.,從中拿取或吸取某種物質。,在進行科學實驗時，我們需要抽取樣本以分析數據。 / 為了提高產品品質，工廠必須定期抽取檢查樣本。 / 在醫學研究中，研究人員需要抽取患者的血液樣本以進行實驗。 / 在數據分析中，我們需要從大量資訊中抽取關鍵數據來支持結論。 / 為了了解市場趨勢，分析師會抽取過去幾年的銷售數據進行比較。 / 在環境研究中，研究者必須抽取土壤樣本以評估污染水平。,vp-t,抽取樣本 / 抽取資料 / 抽取資料 / 抽取數據 / 抽取經驗 / 抽取資源,chōuqǔ,ㄔㄡˉㄑㄩˇ,從中
愁容,4271,愁苦的面容。[例]他因債務纏身而愁容滿面。,A sorrowful expression; a face showing signs of grief or distress.,愁苦的面容。,他的愁容讓人心疼，彷彿背負著整個世界的重量。 / 聽到父母生病的消息，她立刻變得愁容滿面，無法隱藏內心的擔憂。 / 小街的老闆因生意慘淡而愁容不展，顧客所剩無幾，使得他感到壓力沉重。 / 在那張昔日幸福的照片中，愁容取代了曾經的笑容，讓人倍感惆悵。 / 即使在聚會上，她的愁容依然難以掩飾，彷彿淹沒在一陣陣的思緒中。 / 當她聽到那個悲傷的故事時，愁容立刻浮現在她的臉上，感同身受的沉重感令人心碎。,n,愁容滿面 / 滿臉愁容 / 愁容難掩 / 嘴角帶著愁容 / 愁容憂鬱 / 愁容可見,chóuróng,ㄔㄡˊㄖㄨㄥˊ,"展, 感, 慘淡"
抽身,4272,脫身離去，不參與其事。[例]幸好他及早抽身，否則現在被罵的就是他了。,To withdraw or extricate oneself from a situation or involvement.,脫身離去，不參與其事。,這場爭吵讓我感到不自在，於是我決定抽身離開。 / 如果早點抽身，可能就不會捲入這場麻煩之中。 / 他在看到事情的真相後，迅速選擇抽身，不再參與那個計畫。 / 為了保護自己的名聲，她果斷地抽身於這個有爭議的項目。 / 在這次商業談判中，他發現對方不誠實，於是果斷抽身，以免損失更多。 / 他在聚會中感受到不愉快的氣氛，果斷選擇抽身，回家休息。,va-i,抽身離去 / 快速抽身 / 明智地抽身 / 及早抽身 / 不得已抽身 / 理智抽身,chōushēn,ㄔㄡ ㄕㄣ,
仇視,4273,以仇敵的眼光看待。[例]他從小受人欺負，因此仇視周圍的人。,To regard with hostility or animosity.,以仇敵的眼光看待他人，通常帶有強烈的負面情緒。,長期的社會矛盾，使一些人開始仇視不同背景的族群。 / 社交媒體上的仇視言論，常常引發更大的社會分歧與衝突。 / 他不斷仇視社會，覺得自己永遠無法得到公平對待。 / 在校園裡，少數學生因仇視外地來的同學，常常發表刻薄的言論。 / 過去的不公平待遇讓她對整個社會產生了深深的仇視，影響了她的人際關係。 / 在政治辯論中，仇視對手的言辭使得原本理性的討論變得激烈而情緒化。,vs-t,仇視他人 / 仇視對手 / 仇視社會 / 仇視外人 / 仇視不公 / 仇視所有人,qiúshì,ㄑㄧㄡˊㄕˋ,"帶有, 期"
抽絲剝繭,4274,比喻由淺至深逐漸的探索某件事的真相。[例]閱讀偵探小說的樂趣，就是依照書中提供的線索抽絲剝繭，找出真正的凶手。,"To compare the process of unraveling or discovering the truth layer by layer, similar to peeling away the layers of silk from a cocoon.",比喻由淺入深，逐漸探索某件事的真相。,在這次調查中，專家們必須抽絲剝繭，找到事件的真相。 / 偵探利用小線索，抽絲剝繭，最終找到了失竊物品的下落。 / 探索宇宙的奧秘需要科學家們耐心地抽絲剝繭，逐步揭示真相。 / 資深記者在報導中，透過多方資料的對比，抽絲剝繭，還原了事件的全貌。 / 在這部電影中，觀眾隨著主角逐漸抽絲剝繭，體驗到驚人的劇情轉折。 / 這款解謎遊戲的樂趣在於玩家需要抽絲剝繭，找到每一個關鍵線索。,idiom,抽絲剝繭的過程 / 抽絲剝繭的真相 / 抽絲剝繭的方式 / 抽絲剝繭的經過 / 逐步抽絲剝繭 / 抽絲剝繭的重要性,chōusībōjiǎn,ㄔㄡ ㄙ ㄅㄛ ㄐㄧㄢˇ,"失竊, 解"
出醜,4275,丟臉、失體面。[例]我酒量淺，貪杯恐將出醜。,To be embarrassed or humiliated; to suffer loss of face.,丟臉或失去體面。,我原本想在派對上表演舞蹈，結果不小心出醜，讓大家都笑了。 / 朋友說話不小心透露了我的秘密，讓我感到很害怕出醜。 / 昨天的運動會，我因為跌倒出醜，卻反而讓大家覺得很可愛。 / 他在婚禮上誤叫新娘的名字，讓自己出醜，場面一度非常尷尬。 / 她在同學聚會中分享了自己的糗事，結果大家都笑說她真的很容易出醜。 / 我本來不想在同學面前出醜，但沒想到在比賽中失誤了。,idiom,她出醜 / 工作上出醜 / 聚會中出醜 / 笑話出醜 / 不想出醜 / 努力不讓自己出醜,chūchǒu,ㄔㄨㄔㄡˇ,"誤, 糗事, 失誤"
出道,4276,開始從事某種行業。[例]他剛出道時，不過是個沒沒無聞的歌手，經過這幾年的磨鍊，現在已具有相當的知名度了。,"To debut or start a career in a specific field, especially in entertainment.",開始從事某種行業或活動，通常是指初次踏入某個領域。,每位演員都知道，出道之後的壓力會更加沈重，必須不斷努力才能維持知名度。 / 對於出道多年的偶像歌手而言，保持音樂創作的持續性是非常重要的。 / 在選秀節目中，她以出色的表現成功出道，從此展開她的音樂生涯。 / 他出道前花了兩年時間準備，提升自己的演技和舞台魅力。 / 許多新人在出道之前，會參加各種表演訓練，以提升自己的專業技能。 / 對於那些出道不久的演員，獲得一個精彩的角色往往能夠改變他們的職業生涯。,va-i,剛出道的歌手 / 出道不久的演員 / 出道的機會 / 出道後的發展 / 出道前的準備 / 在娛樂圈出道,chūdào,ㄔㄨㄉㄠˋ,"踏入, 言, 初次, 選秀"
觸犯,4277,干犯、冒犯。[例]他因觸犯校規而被記過。,To violate or offend against; to infringe upon.,干犯或冒犯某個規定、法律或他人。,他在考試中作弊，觸犯了學校的行為準則。 / 這位名人因為不當言論而觸犯了社會的道德底線，引起廣泛的討論。 / 他沒有遵守交通規則，結果觸犯了法律，被處以罰款。 / 在娛樂圈中，若經紀人觸犯合約條款，會對藝人的職業生涯造成重大影響。 / 他因為觸犯了國際貿易的相關法律，被禁止參加未來的商業活動。 / 由於未經授權使用他人作品，他觸犯了著作權法，面臨觸犯法律和法律訴訟的風險。,va-t,觸犯法律 / 觸犯規則 / 觸犯道德 / 觸犯紀律 / 觸犯條款 / 觸犯職業道德,chùfàn,ㄔㄨˋㄈㄢˋ,"干, 著作權法, 底線, 經, 若"
出關,4278,出邊塞關口。《史記．卷七五．孟嘗君傳》：「孟嘗君得出，即馳去，更封傳，變名姓以出關。」《初刻拍案驚奇》卷二三：「此後除授東臺御史奉詔出關，行次稠桑驛。」,"To exit a border checkpoint; Specifically, it refers to passing through a border demarcation, often associated with leaving a restricted area.",出邊塞關口，通常指離開邊境的關卡。,雖然我們已經準備好了所有的出關文件，但海關還是仔細檢查了一遍。 / 最近，因為疫情的影響，出關的規定變得更加嚴格，許多人不得不推遲旅行計畫。 / 在出關之前，我必須確認我的護照和簽證都是有效的，以免在海關遇到麻煩。 / 這次出關檢查特別嚴格，所有的行李都必須接受X光檢查，以確保安全。 / 出關時，我看到許多家庭依依不捨，留戀著彼此的陪伴，讓我感受到濃厚的情感。 / 像我這樣的商務人士，經常需要快速出關，以便能夠及時參加國外的重要會議。,va-i,出關的手續 / 出關的文件 / 出關的檢查 / 出關的流程 / 批准出關 / 出關後,chūguān,ㄔㄨㄍㄨㄢ,"X, 塞關, 疫情"
出汗,4279,流汗。[例]運動之後大量出汗，必須喝水補充體內流失的水分。,To sweat; to exude perspiration.,流汗的行為，一般是在運動或高溫環境下，身體透過皮膚分泌水分。,在夏天的時候，即使只是站著，身體也會出汗。 / 在游泳池邊待太久，蒸人的熱氣讓我也有點出汗了。 / 在炎熱的午后，走路出汗是非常正常的現象。 / 他們在登山的過程中，由於氣候炎熱，幾乎是每走一段路就會出汗。 / 參加完舞會後，他們都因為跳舞過於激烈而出汗不淺。 / 在家庭聚會上，熱絡的談話讓每個人都因為氣氛太熱烈而出汗。,va-i,大量出汗 / 運動後出汗 / 熱天出汗 / 經常出汗 / 出汗的感覺 / 開始出汗,chūhàn,ㄔㄨㄏㄢˋ,"熱氣, 午后"
出類拔萃,4280,遠超出同類之上，高出同群。形容才能特出，超越同儕。語本《孟子．公孫丑上》。[例]他不斷自我超越，希望成為出類拔萃的豪傑之士。,Outstanding and surpassing others in a particular field or ability; Exceeding peers or counterparts in talent or achievement.,遠超出同類之上，高出同群。形容才能特出，超越同儕。,在這次科學競賽中，他的研究成果出類拔萃，贏得了評審的高度讚賞。 / 老師一直鼓勵學生發揮個人特長，讓每個人都能在某個領域出類拔萃。 / 這部電影的劇本和演技都出類拔萃，因此成為了今年的票房冠軍。 / 在眾多候選人中，她的領導才華和溝通能力讓她顯得出類拔萃。 / 這位運動員在比賽中的表現出類拔萃，創下了多項紀錄，令人驚嘆。 / 這本書的內容精緻且見解獨到，使其在眾多出版物中出類拔萃，成為暢銷書。,idiom,出類拔萃的人才 / 出類拔萃的表現 / 出類拔萃的學生 / 出類拔萃的領袖 / 出類拔萃的作品,chūlèibácuì,ㄔㄨˉㄌㄟˋㄅㄚˊㄘㄨㄟˋ,"同, 暢銷書, 類拔萃, 特, 創"
矗立,4281,高聳直立。[例]廣場正中矗立著一棟高達四十層的大樓，格外引人注目。,"To stand tall and upright, usually referring to a structure or object.",高聳直立，通常用來形容物體。,海邊矗立著一座美麗的燈塔，指引著漁船安全返回港口。 / 山頂矗立的古寺，吸引了無數遊客前來朝聖和欣賞風景。 / 矗立在市中心的高樓大廈，讓整個城市看起來更加繁忙和現代化。 / 在遙遠的村莊外，矗立著一座古老的城堡，講述著歷史的悠久與神秘。 / 矗立於海岸的岩石，經歷了無數風浪，依然堅定不移地守護著這片土地。,va-i,矗立的建築 / 矗立的塔樓 / 矗立的燈塔 / 矗立的教堂 / 矗立的高塔 / 矗立於市中心,chùlì,ㄔㄨˋㄌㄧˋ,"移, 古寺, 遊客, 燈塔, 山頂"
出籠,4282,顯露。[例]他耍寶、模仿的本領一出籠，立刻使現場的氣氛熱烈起來。,To reveal or display one's skills or abilities.,顯露出來，通常是指某種能力、特質或狀態突然表現出來。,他的幽默感一出籠，讓整個晚會的氣氛變得輕鬆愉快。 / 這位作家的新書一出籠，立即引起了讀者的熱烈討論。 / 在藝術展覽上，那幅畫作出籠的時候，讓觀眾感受到前所未有的震撼。 / 當他的創意設計出籠，客戶都對他的想法讚不絕口。 / 她的舞蹈技巧一出籠，評審們都對她的表現感到驚訝。 / 當科學家的新研究成果出籠，學術界對此展開了熱烈的討論。,idiom,出籠的才華 / 出籠的能力 / 出籠的表現 / 讓想法出籠 / 出籠的魅力,chūlóng,ㄔㄨㄌㄨㄥˊ,
出籠,4282,從蒸籠裡取出。[例]剛出籠的蘿蔔糕，即使不沾作料，仍然十分好吃。,To take food out of a steaming basket.,從蒸籠裡取出，通常指剛做好或剛煮好的食物。,剛出籠的包子熱氣騰騰，味道讓人垂涎欲滴。 / 朋友告訴我昨天剛出籠的糕點非常新鮮，還有獨特的香味。 / 出籠的鮮蝦蒸餃，令人忍不住想馬上品嚐它的美味。 / 晚餐時，剛出籠的米糕搭配著濃郁的醬汁，讓人食指大動。 / 這家茶樓的出籠點心每次都能帶給我不同的驚喜和愉悅感受。 / 剛出籠的紅豆饅頭，雖然看起來普通，但口感卻讓人感到意外的美好。,va-t,剛出籠的點心 / 新鮮出籠的包子 / 熱騰騰出籠的饅頭 / 剛出籠的蛋糕 / 出籠的米糕,chūlóng,ㄔㄨㄌㄨㄥˊ,"熱氣, 糕點, 鮮蝦, 騰, 紅豆, 米糕"
出沒,4283,時現時隱，常指在某區域活動往來。[例]附近山區常有黑熊出沒，行旅往來此地要特別提高警覺。,"To appear and disappear in an unpredictable manner, often referring to frequent activity in a certain area.",時而出現，時而隱藏，常指在某個區域活動或來往。,在此區域，經常有小偷出沒，居民們對陌生人都格外警惕。 / 訪客需注意，近期有野狼在附近出沒，行走時務必提高警覺。 / 在海灘附近，有時會看到海龜出沒，這吸引了不少遊客的注意。 / 這片森林出沒著許多野生動物，尤其是夜晚更加活躍，遊客需小心行駛。 / 每當電影拍攝期間，劇組人員經常看到明星出沒，成為粉絲聚焦的熱點。 / 當秋季來臨時，許多鳥類會在這個湖泊出沒，為觀鳥愛好者帶來極大的樂趣。,vp-i/N,森林出沒 / 夜晚出沒 / 經常出沒 / 不定期出沒 / 附近出沒 / 山區出沒,chūmò,ㄔㄨㄇㄛˋ,"野狼, 劇, 近期, 遊客, 海龜, 訪客"
處女,4284,比喻未開發的或是首次。[例]處女航、處女作,"A term metaphorically referring to something that is undeveloped or in its initial stage; for example, ""maiden voyage"" or ""maiden work.""",比喻尚未開發或是首次出現的事物。,這對新婚夫婦的處女航旅行充滿了浪漫與期待。 / 她的處女作品受到了廣泛的好評，讓她在文壇上初露頭角。 / 這部處女電影成功吸引了許多觀眾，獲得了不錯的票房收入。 / 在校園音樂會上，他的處女演出讓眾多同學刮目相看。 / 這位年輕作家的處女作描繪了他對家鄉的深厚情感。 / 她的處女秀讓所有觀眾驚豔，展現了她非凡的表演才華。,n,處女作 / 處女專輯 / 處女演出 / 處女秀 / 處女航 / 處女電影,chǔnǚ,ㄔㄨˇㄋㄩˇ,"尚未, 新婚, 處女秀, 處女作, 航"
