word,number,old_definition,translation,definition,example_sentences,part_of_speech,collocations,pinyin,zhuyin,problematic_words
斐然,4758,有文采的樣子。[例]斐然成章,Notable for its literary elegance; showing clarity and order in expression.,有文采的樣子，形容文章或言辭流暢而富有文學美感。,那位詩人的作品雖然不多，但每一首詩都是斐然成章，讓人感受到深厚的文學底子。 / 這家公司在市場上的表現成果斐然，成功擴大了市場份額，成為行業的新星。 / 這本小說的情節緊湊，再加上作者文采斐然，讓讀者徹底沉浸在故事世界中。 / 經過長時間的努力，他的研究成果斐然，獲得了學術界的廣泛認可。 / 他的努力和堅持終於有了回報，在學校的期末考中名列前茅，成績斐然。 / 這支隊伍在國際比賽中表現出色，成績斐然，成功奪得金牌。,vs-adj,斐然成章 / 政績斐然 / 文采斐然 / 成績斐然 / 成就斐然 / 成果斐然,fěirán,ㄈㄟˇㄖㄢˊ,"額, 奪得, 星, 成章, 期末考"
非同小可,4759,形容事情的重要或情況嚴重。[例]這件事非同小可，沒有證據千萬別隨便傳出去。,Serious; Not to be taken lightly; This phrase is used to emphasize that a situation is important or severe.,形容事情的重要性或情況的嚴重性，不能輕視。,他在這場商業談判中的表現非同小可，不僅成功達成協議，還爭取到了公司最大的利益。 / 他們之間的爭執非同小可，如果不及時處理，可能會導致兩人關係的破裂。 / 這場比賽的重要性非同小可，關係到球隊能不能晉級決賽。 / 當前的環境問題非同小可，每個人都應該積極參與保護地球的行動。 / 這次的環境污染事件非同小可，對當地生態系統造成了嚴重影響，需要立即採取行動。 / 這個研究的結果非同小可，可能會改變我們對於疾病治療方式的理解。,idiom,問題非同小可 / 情況非同小可 / 影響非同小可 / 後果非同小可 / 意義非同小可 / 重要性非同小可,fēitóngxiǎokě,ㄈㄟ ㄊㄨㄥˊ ㄒㄧㄠˇ ㄎㄜˇ,能不能
肥沃,4760,土質養料多，生產力大。[例]肥沃的土地，不用化學肥料滋養，也能年年豐收。,Fertile; having a rich and productive quality in soil.,土質多滋養料，富含養分。,這片肥沃的土壤，每年都有豐富的收成，為當地農民帶來穩定的收入和生活保障。 / 如果土地肥沃，農民將能夠種植更多的作物，改善生活水平。 / 肥沃的土壤裡，隱藏著大自然賜予的人類最珍貴的資源。 / 在這個肥沃的地區，收成一年比一年好，成為當地居民的主要收入來源。 / 美麗的田野裡，肥沃的土壤孕育著無數生命，展現出自然的奇蹟。 / 如果我們能夠保護這些肥沃的土地，未來的世代也能享受到豐富的自然資源。,vs-adj,肥沃的土地 / 肥沃的土壤 / 肥沃的農地 / 肥沃的田地 / 肥沃的地區 / 肥沃的耕地,féi wò,ㄈㄟˊ ㄨㄛˋ,"農地, 耕, 料, 土質"
非議,4761,批評、指責。[例]他一提出報告，馬上遭到與會人士的非議。,Criticism; Reproach.,對某人或某事提出批評和指責。,這位政治人物的言論經常招致非議，讓他的支持者感到困擾。 / 這項政策雖然有其必要性，但仍然受到社會各界的非議。 / 他對擔任公司執行長的人選提出質疑，因此在外界引起許多非議。 / 在討論這個計劃時，幾位專家的意見引發了不少非議，讓整個會議氣氛變得緊張。 / 他在社交媒體上的評論引發了非議，許多人對他的觀點表示強烈反對。 / 儘管這部電影獲得了不少獎項，但仍然因其敏感題材而受到非議。,n,招致非議 / 受到非議 / 面對非議 / 遭到非議 / 引起非議 / 帶來非議,fēiyì,ㄈㄟ ㄧˋ,議
匪夷所思,4762,不是根據常理所能想像得到的。[例]他明明做錯事卻得到奬賞，真是令人匪夷所思。,Unimaginable; Beyond the realm of common understanding or reason.,不是根據常理所能想像得到的。,他明明有能力考上好學校，卻選擇放棄，這樣的決定實在讓人匪夷所思。 / 為什麼一個如此年輕的藝術家能夠創作出如此深刻的作品，讓人匪夷所思。 / 他居然不惜一切代價要買一部老舊的車，這種匪夷所思的執著讓朋友們都覺得奇怪。 / 中一次大獎有人相信，連連中好幾次就匪夷所思了。 / 在這個資訊爆炸的時代，還有人願意相信那些明顯不真實的消息，這種匪夷所思的現象讓媒體十分擔憂。 / 他的行為簡直匪夷所思，不但違反了規則，還因此遭到了嚴重的處罰。,idiom,令人匪夷所思 / 實在匪夷所思 / 讓人匪夷所思 / 匪夷所思的想法 / 簡直匪夷所思 / 匪夷所思的事情,fěiyísuǒsī,ㄈㄟˇㄧˊㄙㄨㄛˇㄙㄧ,
飛越,4763,飛行越過。[例]他駕著小飛機，完成飛越太平洋的壯舉。,To fly over or across.,飛行越過某一物體或地區。,在他的心中，夢想就像一隻展翅的鳥，無畏艱難地飛越所有阻礙。 / 這款最新的無人機能夠飛越高山，克服極端天氣，完成救援任務。 / 在那次旅行中，他們駕駛的小飛機成功飛越了幾乎所有的國界，讓他們體驗了不同的文化。 / 這位詩人在詩篇中表達了他對自由的渴望，希望能夠飛越一切束縛，追尋心中的理想。 / 科學家們的研究使飛機能夠輕松飛越海洋，縮短了各國之間的距離。 / 駕駛員熟練地操控飛機，飛越雲層時的那一瞬間，他感受到無比的震撼與自豪。,va-i,飛越海洋 / 飛越海洋 / 飛越大陸 / 飛越天空 / 飛越邊境 / 飛越高山,fēiyuè,ㄈㄟ ㄩㄝˋ,"越過, 機"
飛躍,4764,動作快速，比喻事物有快速而突破性的進展。[例]近年來，臺灣的經濟有飛躍的進步。,To leap or make a significant breakthrough rapidly.,動作快速，或事物有快速而突破性的進展。,這幾年，科技的進步讓醫療領域有了飛躍性的發展。 / 小朋友的學習能力驚人，經過一年的努力，他的英文水平有了飛躍性的提升。 / 在軍事科技的迅速發展中，無人機的應用取得了飛躍性的進步。 / 今年參加國際科學競賽的學生們，展現了他們在創新思維上飛躍般的成長。 / 在數位科技的浪潮中，傳統行業的營運效率實現了飛躍性提升。 / 這些年來，科技的投入使得作物的產量達到了飛躍式的增長。,vp-i/N,飛躍性的發展 / 飛躍般的成長 / 飛躍性的進步 / 飛躍式的增長 / 飛躍性的提升 / 飛躍的機會,fēiyuè,ㄈㄟ ㄩㄝˋ,機
廢止,4765,廢除、停止不用。[例]該項法令早已廢止，目前已有新法取代。,To abolish or annul; to cease or stop something from being used or recognized.,廢除、停止使用。,根據新的環保政策，舊的排放標準已經被廢止，所有企業必須遵循更新的規範。 / 經過廣泛的討論，政府最終決定廢止行業補貼政策，以促進公平競爭。 / 為了適應全球環保趨勢，許多國家已完全廢止一次性塑膠用品的使用，推動可持續發展。 / 該項計劃因預算不足而廢止，讓許多支持者感到失望。 / 這項舊制度已不再符合現代發展需求，相關部門正著手逐步廢止，並制定新的規範。 / 有些國家因應時代變遷，逐步廢止過時的貿易協定，以促進更靈活的經濟合作。,vp-t,廢止法令 / 廢止政策 / 廢止許可證 / 廢止合約 / 逐步廢止 / 完全廢止,fèizhǐ,ㄈㄟˋㄓˇ,許可證
粉筆,4766,用白堊或熟石膏製成，細條狀，用來在黑板書寫、畫圖的筆。[例]在投影機及電腦未發明之前，老師只能依賴用粉筆在黑板上板書的方式教學。,"A piece of chalk; A writing tool made from calcium carbonate or gypsum, used for writing or drawing on blackboards.",用於書寫在黑板上。粉筆一般呈長型圓柱體，顏色包括白色和多種彩色。,在缺少電子設備的日子，粉筆是教室中不可或缺的教學工具。 / 每當粉筆在黑板上劃過時，會發出沙沙的聲音，讓人覺得懷舊。 / 使用粉筆時，老師特別注意不要弄髒自己的衣服。 / 一支粉筆能夠讓學生們在黑板上自由表達自己的想法。 / 粉筆的顏色有許多種，讓黑板上的字體顯得更加生動。 / 擦除粉筆字跡後，黑板上總是留下淡淡的白色痕跡，提醒著我們曾經的學習。,n,一支粉筆 / 粉筆的顏色 / 粉筆的字跡 / 粉筆和黑板 / 使用粉筆 / 擦除粉筆字跡,fěnbǐ,ㄈㄣˇㄅㄧˇ,"型, 圓柱, 弄髒"
糞便,4767,大便。[例]對於農家而言，糞便是一種天然肥料。,Feces; the solid waste excreted from the digestive tract.,或稱大便，是人體或動物排出的廢棄物。,醫生透過糞便分析，幫助病人找到消化問題的根源。 / 每種動物的糞便都有不同的特徵，這對於研究生態系統非常關鍵。 / 使用動物或人類糞便當作肥料能提高作物的產量，減少使用化學品對土地的傷害。 / 視察野生動物時，專家們經常會收集糞便樣本，以了解牠們的飲食習慣。 / 有些植物能從動物糞便中吸收養分，因此它們在生態中扮演著重要的角色。 / 糞便中的細菌對於土壤的肥力有著不可忽視的影響。,n,糞便的氣味 / 排出糞便 / 糞便樣本 / 糞便分析 / 動物的糞便 / 糞便的用途,fènbiàn,ㄈㄣˋㄅㄧㄢˋ,
奮不顧身,4768,勇往向前，不顧生死。[例]車禍發生時，他奮不顧身的搶救受傷的乘客。,"To act with reckless abandon, disregarding one's own safety or life.",勇往直前，不在乎生死。,看到車禍的情況後，他奮不顧身地上前幫忙，試圖穩住受傷者的頭部。 / 面對海嘯的威脅，那些義工奮不顧身地投入救援行動，展現出無私的愛心。 / 他們在大雨中奮不顧身地衝上前，只為了搶救受傷的患者。 / 他在火場中展現了奮不顧身的精神，冒著生命危險救出了被困的人員。 / 在地震發生後，義工們奮不顧身地投入協助救援的行列，希望能找到被更多生還者。 / 面對不法侵害，勇敢的市民奮不顧身地站出來，阻止了罪犯的行為，展現了社會的正義。,idiom,奮不顧身地站出來 / 奮不顧身的精神 / 奮不顧身地跳下水 / 奮不顧身地投入 / 奮不顧身地衝上前 / 奮不顧身地保護,fèn bù gù shēn,ㄈㄣˋ ㄅㄨˋ ㄍㄨˋ ㄕㄣ,"穩住, 奮"
分寸,4769,辦事或言語合適的程度。[例]政治人物發言時，要懂得拿捏分寸。,A measure of appropriateness or discretion in actions or speech.,做事或說話適量的標準或限度。,在工作場合，說話的分寸很重要，否則可能會引起誤會。 / 他在朋友聚會時，懂得拿捏開玩笑的分寸，讓氣氛更輕鬆。 / 政治人物發言時，要知道拿捏分寸，避免引起爭議。 / 在婚禮上，掌握分寸的祝福語能讓賓客覺得溫馨，讓新人感受到真摯的祝福與喜悅。 / 在人際交往中，適當的分寸能幫助我們保持關係的和諧，既不疏遠也不越界。 / 這位導演在拍攝電影時，非常注意鏡頭語言的分寸，以傳達更深的情感。,n,掌握分寸 / 說話的分寸 / 拿捏分寸 / 適當的分寸 / 分寸感 / 注意分寸,fēncùn,ㄈㄣ ㄘㄨㄣˋ,"適量, 感, 既"
分道揚鑣,4770,鑣，馬嚼子。揚鑣，驅馬前進。比喻本來共處的人，後因志向、目的不同而各奔前程。語本《北史．卷十五．魏諸宗室傳．河間公齊傳》。[例]他們原本形影不離，但畢業後便分道揚鑣，十幾年來都沒有再見過面。,To part ways and pursue different paths or goals; originally shared a common direction but ultimately diverged due to differing intentions.,本來一起的人因為志向或目的不同，而各自走上不同的路。,在經歷了幾次激烈的討論後，團隊中的成員因策略分歧而選擇分道揚鑣。 / 隨著時間的推移，他們的興趣和目標逐漸出現差異，因此最終選擇了各自分道揚鑣。 / 曾經有著共同夢想的他們，最終因為人生選擇不同而分道揚鑣，展開各自的旅程。 / 在經歷了一場重要的比賽後，兩位運動員因為對未來的規劃不同，而各自分道揚鑣，追尋自己的職業路。 / 雖然曾經一起合作經營，但由於理念和管理風格的差異，他們最終分道揚鑣，各自發展。 / 他們因追求不同的職業目標而選擇了分道揚鑣，尋找各自的機會。,idiom,分道揚鑣的原因 / 最終分道揚鑣 / 選擇分道揚鑣 / 決定分道揚鑣 / 因為理想不同而分道揚鑣 / 從此分道揚鑣,fēndàoyángbiāo,ㄈㄣ ㄉㄠˋ ㄧㄤˊ ㄅㄧㄠ,
分段,4771,就時間或區域分成幾個部分。或指劃分文章的段落。例]新的公路交由幾個承包商分段負責承建。,To divide into sections based on time or area; to allocate portions for specific tasks.,將時間或區域劃分成幾個部分，或是將文章劃分成段落。,為了讓故事更清晰，我將文章分段，每一段集中在一個主題上。 / 教師在課堂上分段講解，使學生更容易理解複雜的內容。 / 為了讓學生更容易消化知識，課程內容通常會按照主題分段設計。 / 在寫作時，清晰的分段能幫助讀者更好地理解文章的結構和情感。 / 在進行語言學習時，老師經常將課堂內容分段，以便學生能夠逐步掌握每個語言要素。 / 為了方便管理，我們需要將工作任務進行分段，這樣可以提高完成工作的效率。,vp-t/N,文章分段 / 分段進行 / 分段施工 / 分段講解 / 分段整理 / 分段報告,fēnduàn,ㄈㄣ ㄉㄨㄢˋ,
奮發,4772,激勵振作。[例]人人奮發向上，國家才有光明的前途。,To strive with enthusiasm and vigor; to be motivated and energetic.,激勵振作，努力向上。,在艱難的時刻，他們依然奮發向前，不害怕任何挑戰。 / 這位老師經常鼓勵學生奮發進取，勇敢面對考試壓力。 / 當國家遇到困難時，人民都奮發圖強，共同克服難關。 / 在競賽中，選手們以奮發向上的態度，努力爭取每一寸榮耀。 / 這本書激勵了許多讀者，讓他們奮發向前，追求更高的目標。 / 體育館裡，運動員們在教練的鼓勵下奮發向上，力求突破自我極限。,va-i,奮發向上 / 奮發圖強 / 奮發努力 / 奮發進取 / 奮發有為 / 奮發向前,fènfā,ㄈㄣˋㄈㄚ,奮發圖強
分發,4773,分派人員前往某處。[例]他們被分發到同一單位工作。,To assign or send personnel to a designated location.,將人員指派到某個地方或某個單位工作。,在活動開始前，義工們已經完成了分發工作，將所有宣傳資料準確地送到參與者手中。 / 公司人事部已公告分發通知，所有員工需要在本周五前完成年度健康檢查的預約。 / 義工根據各自的專長進行分發，有醫療背景的負責急救，有工程背景的協助重建。 / 新兵訓練結束後，人員分發至不同的部隊，以補充各單位的兵力需求。 / 災區救援需要精密的計劃，人員分發必須根據專業技能進行，確保資源分配的效率和效果。 / 新招聘的員工經過培訓後，被分發到各個單位，開始適應不同崗位的工作需求。,va-t,進行分發 / 分發到單位 / 人員分發 / 分發工作 / 分發通知 / 確認分發,fēnfā,ㄈㄣ ㄈㄚ,"招聘, 新兵"
分發,4773,分配發給。[例]政府分發米糧賑濟災民。,"To distribute or allocate something, usually in a manner that is assigned or designated.",分配發給某人或某團體。,政府定期分發物資，讓許多困難家庭感到生活有了希望。 / 物資分發的時間安排得當，確保每個人都能及時拿到所需的物品。 / 大會分發的宣傳冊，讓參與者更了解會議的主題與流程。 / 在新學期開始時，老師會分發給學生的教材，幫助他們更好地準備課程。 / 社區中心計畫在下個月分發冬衣，以幫助那些需要幫助的人。 / 義工們在節日慶典上，分發祝福卡片，讓每個人都感受到節日的喜悅。,va-t,分發物資 / 分發冬衣 / 分發米糧 / 分發獎品 / 分發獎金 / 分發教材,fēnfā,ㄈㄣ ㄈㄚ,"冬衣, 米糧"
芬芳,4774,香氣。[例]百花競吐芬芳。,Fragrant; having a pleasant and sweet smell.,花朵、植物所散發出的香氣。,春天來臨時，花朵開始盛開，四處散發著芬芳的氣息。 / 我走在公園的小路上，耳邊是鳥兒的鳴叫，鼻尖是花草的芬芳。 / 美麗的花園裡，種著各種各樣的菊花，芬芳迷人。 / 眼前是一大片的玫瑰花園，微風拂過，花香四溢，芳香撲鼻。 / 這片花海中，芬芳的香氣撲鼻而來，彷彿置身於仙境。 / 坐在河邊，聞著芬芳的野薑花香氣，心中不禁浮現出對童年的懷念。,n,芬芳撲鼻 / 芬芳迷人 / 馥郁芬芳 / 芬芳的味道 / 芬芳的香氣 / 芬芳四溢,fēnfāng,ㄈㄣ ㄈㄤ,"花草, 郁芬芳, 鼻尖, 馥, 菊花, 野薑, 鳥兒"
紛飛,4775,眾多而雜亂的飛舞。[例]落葉紛飛、大雪紛飛,To flutter or fly in a chaotic and numerous manner.,眾多而雜亂地飛舞。,秋天來臨時，銀杏的葉子紛飛，讓整個公園都籠罩在金黃色的浪潮中。 / 在春天的午後，微風吹過，花瓣紛飛，空氣中彌漫著淡淡的花香。 / 隨著風向的改變，柳絮紛飛，彷彿無數小精靈在空中舞蹈。 / 在節日慶典上，五彩的紙碎紛飛，增添了喜慶的氛圍。 / 大雪紛飛的夜晚，整座城市被厚厚的白雪覆蓋，如同進入了一個夢幻的世界。 / 在紀念活動中，火把燃燒的落灰紛飛，照亮了每個人的心靈，讓人感受到無限的懷念。,va-i,落葉紛飛 / 花瓣紛飛 / 雪花紛飛 / 柳絮紛飛 / 大雪紛飛 / 五彩的紙碎紛飛,fēnfēi,ㄈㄣ ㄈㄟ,"午後, 落葉, 白雪, 紛, 絮, 杏, 花瓣, 喜慶, 金黃"
忿忿不平,4776,憤怒且心中感到不平。[例]雖然這件事情已經過去很久了，他仍然忿忿不平。,Angry and discontented; feeling resentful and unfair.,心中感到憤怒，對某種不公正的事情無法接受。,在比賽中，裁判的錯誤判決讓選手們忿忿不平，直言要求改換裁判。 / 他因為承受了不公平的指責而忿忿不平，無法平靜下來。 / 她對於這項政策的不公感到忿忿不平，決定參加抗議活動。 / 這部電影對歷史的扭曲讓觀眾們忿忿不平，紛紛在網路上留言批評。 / 學校的評審標準不公，許多學生因此忿忿不平，感到自己的努力被忽視了。 / 最近的事件引發了社會各界忿忿不平的情緒，大家都在討論如何改變現狀。,idiom,忿忿不平的心情 / 忿忿不平的感受 / 忿忿不平的情緒 / 感到忿忿不平 / 覺得忿忿不平 / 忿忿不平地反駁,fènfènbùpíng,ㄈㄣˋㄈㄣˋㄅㄨˋㄆㄧㄥˊ,改換
憤憤不平,4777,心中氣惱、不服。[例]員工對上級違背公平原則的作法憤憤不平，正蘊釀抗爭行動。　△忿忿不平,Indignant and resentful; feeling aggrieved and unjustly treated.,憤怒且心中感到不平。,她對於這個不公平的評分標準感到憤憤不平，認為自己的努力沒有被重視。 / 這位市民因為交通處罰的標準不一，心中憤憤不平，決定向相關單位反映問題。 / 在聽到朋友受到不公正待遇的故事後，她感到憤憤不平，決定站出來支持朋友。 / 這些員工對於公司裁員的決定感到非常憤憤不平，因為他們認為自己的付出不應該受到如此對待。 / 當他發現自己的作品被他人抄襲而沒有得到應有的承認時，心中憤憤不平，覺得自己的努力被輕視。 / 在社區會議上，許多居民對環境污染問題表達了憤憤不平，要求政府採取更有效的措施來解決問題。,idiom,心中憤憤不平 / 群眾憤憤不平 / 感到憤憤不平 / 人民憤憤不平 / 內心憤憤不平 / 始終憤憤不平,fènfènbùpíng,ㄈㄣˋㄈㄣˋㄅㄨˋㄆㄧㄥˊ,
分工合作,4778,將一件事分由眾人共同完成。[例]大家分工合作，事情較易完成。,A collaborative effort where tasks are divided among individuals to achieve a common goal.,將一件事情分成不同的部分，由多個人一起完成，通常能提高清效率和完成品質。,在這次的志工活動中，我們採取了分工合作的方式，讓每個人都能發揮所長。 / 為了提高辦公室的工作效率，大家都應該學習如何進行有效的分工合作。 / 在這個專案中，大家一起分工合作，將能大幅提升最終成果的品質。 / 在學校的團隊專題報告中，學生們透過分工合作，讓報告內容更為充實。 / 在社區的環保活動中，大家分工合作，共同為改善環境出一份力。 / 分工合作的重要性不僅體現在工作效率上，更能增強團隊之間的凝聚力。,phrase,大家分工合作 / 一起分工合作 / 團隊分工合作 / 互相分工合作 / 兩人分工合作 / 透過分工合作,fēngōng hézuò,ㄈㄥ ㄍㄨㄥ ㄏㄜˊ ㄗㄨㄛˋ,
憤恨,4779,憤怒、怨恨。[例]憤恨不平、憤恨難消,Resentful and filled with deep anger; indicating strong feelings of indignation and bitterness.,心中對某人或某事感到非常的不滿和怨恨，通常伴隨著憤怒。,她對這不公平的處罰感到憤恨，心中充滿了對制度的質疑。 / 看到自己的努力被忽視，他感到憤恨不已，難以平息心中的怒火。 / 憤恨的情緒在他的心中翻騰，讓他難以專注於工作。 / 他投來憤恨的眼神，彷彿對那個背叛他的朋友感到無比的失望和痛苦。 / 她看到新聞中揭露的醜聞，心中感到憤恨不平，決定參加抗議活動。 / 他臉上寫滿了憤恨的表情，顯然對這個不公平的決策感到無法容忍。,n,憤恨不平 / 憤恨不已 / 憤恨的心情 / 憤恨的表情 / 憤恨的眼神 / 感到憤恨,fènhèn,ㄈㄣˋㄏㄣˋ,仿佛
焚毀,4780,燒毀。[例]為了表示不再留戀過去，他焚毀所有的日記。,To burn or destroy by fire.,燒毀；把東西用火燒成灰燼。,為了保護機密，工作人員在會議結束後將所有的文件焚毀。 / 由於消防設施不完善，這座歷史悠久的建築最終還是被大火焚毀，讓人痛心不已。 / 他將過去跟她的信件焚毀，象徵著他對兩人過往的不再留戀。 / 在藝術展覽中，一位藝術家選擇焚毀他的舊作品，以此來表達對新創作的追求。 / 學校規定，畢業生可以在操場選擇焚毀舊課本，以象徵他們新的開始。 / 他的朋友們陪他一起焚毀那些不再需要的物品，幫助他走出失戀的陰影。,va-t,焚毀日記 / 焚毀所有文件 / 焚毀物品 / 焚毀過去的回憶 / 被大火焚毀 / 遭到焚毀,fénhuǐ,ㄈㄣˊㄏㄨㄟˇ,
分際,4781,分開、析開。《兒女英雄傳》第二五回：「這是安老爺、安太太一年的水磨工夫，纔陶鎔得姑娘這等幽閑貞靜，又兼看著九公有個師徒分際、褚大娘子有個妹妹情腸，纔得這樣款款而談。」,To separate or analyze distinctions.,分開、析開的界限或標準。,在這個團隊中，成員之間要明確知曉工作分際，以提高效率。 / 作為一名專業人士，她嚴守分際，從不將私人情感混入工作中，始終保持高度的職業道德。 / 他一向嚴守分際，無論在工作還是私人生活中，都能夠保持適當的界限，讓人十分佩服。 / 在義工工作中，義工的工作分際必須明確，以確保活動的順利進行。 / 要是能夠明確工作與生活的分際，或許我們能夠更好地平衡事業與家庭，減少壓力。 / 朋友之間如果能夠清晰地定義各自的分際，會讓友誼更加長久。,n,師生之間的分際 / 嚴守分際 / 男女分際 / 工作與生活的分際 / 逾越分際 / 工作分際,fēnjì,ㄈㄣ ㄐㄧˋ,"男女, 師, 析"
分解,4782,將整體拆分成部分。[例]槍枝分解、因數分解,To decompose or break down into parts.,將整體拆分成若干部分。,在數學課上，老師教我們如何進行因數分解，以便更容易解決這道問題。 / 科學家研究化學分解反應，以了解不同物質如何相互作用。 / 現代化的垃圾處理技術使垃圾分解過程更加高效，減少了對環境的污染。 / 在物理學中，物體的運動可以被分解成不同的力，以便更清楚地分析問題。 / 這些藥物經過消化系統後迅速分解，釋放出活性成分，達到治療效果。 / 這些有機垃圾經過特殊處理後能夠快速分解，轉化為有用的堆肥，對土壤有益。,vp-t,因數分解 / 垃圾分解 / 屍體分解 / 藥物分解 / 槍枝分解 / 迅速分解,fēnjiě,ㄈㄣ ㄐㄧㄝˇ,"轉化為, 有益, 效, 堆肥"
