word,number,old_definition,translation,definition,example_sentences,part_of_speech,collocations,pinyin,zhuyin,problematic_words
愛不釋手,3741,喜歡得捨不得放手。[例]他一見到那個貝殼，就愛不釋手的把玩。,To be so fond of something that one cannot bear to part with it; to cherish or hold dear.,形容非常喜歡某樣東西，讓人捨不得放手。,"這幅畫作展現了藝術家的獨特風格，令人愛不釋手。 / 那本書的故事情節扣人心弦，讓讀者愛不釋手地一口氣看完。 / 她在市場上發現了一束鮮花，色彩絢麗，讓她愛不釋手，決定立刻買下。 / 他得到了一件限量版的運動鞋，精緻的設計讓他愛不釋手，天天都想穿著出門。 / 她找到了一本充滿手寫筆記的旅行日誌，裡面的每一頁都讓她愛不釋手，想要細細品味。 / 這條手鏈的每一顆珠子都有特別的含義，讓她愛不釋手，無法忍心摘下，就像她永遠不會放下那本愛不釋手的書籍。""",idiom,令人愛不釋手 / 讓人愛不釋手 / 愛不釋手的藝術品 / 愛不釋手的手錶 / 愛不釋手的電影 / 愛不釋手的珠寶,àibùshìshǒu,ㄞˋㄅㄨˋㄕㄧˋㄕㄡˇ,
哀愁,3742,哀傷悲愁。[例]家中突遭巨變，使他陷入一片哀愁之中。,A state of deep sorrow and melancholy; characterized by profound grief and sadness.,深深的悲傷和愁苦。,他的眼中流露出深深的哀愁，讓我忍不住想安慰他。 / 音樂中充滿了哀愁的旋律，讓聽者心中不禁泛起一陣惆悵。 / 失去摯友後，他的心中籠罩著一片無法驅散的哀愁。 / 在這個寂靜的夜晚，他獨自坐在窗前，思索著生活中的種種哀愁。 / 在海邊散步時，他望著波浪翻滾，心中升起了無法形容的哀愁。 / 聽到那首老歌，他的內心充滿了哀愁，似乎喚起了許多失去的回憶。,n,充滿哀愁 / 內心的哀愁 / 無法擺脫的哀愁 / 哀愁的旋律 / 面對哀愁 / 沉浸在哀愁中,āichóu,ㄞ ㄔㄡˊ,
愛戴,3743,敬愛擁戴。[例]執政者勤政愛民，必定會受人民愛戴。,"To be loved and supported by the people, signifying respect and affection received from the public.",對某人或某事懷有敬意和愛慕的情感，並願意支持和擁護。,這位醫生的無私奉獻精神，讓他在社區中深受愛戴。 / 為了表彰義工的付出，社區舉辦了一個獎勵活動，讓義工感受到居民的愛戴。 / 他用心傾聽友人的煩惱，因而在朋友圈中獲得了大家的愛戴。 / 這位科學家的創新研究，讓他在學術界受到同行的愛戴和敬重。 / 在年終晚會上，大家齊聲感謝這位默默奉獻的同事，讓他倍感愛戴和溫暖。 / 市長推動環保政策，得到了市民的支持與愛戴。,n,受人愛戴 / 獲得愛戴 / 倍感愛戴 / 人民的愛戴 / 居民的愛戴 / 深受愛戴,àidài,ㄞˋㄉㄞˋ,
哀悼,3744,哀傷悼念。[例]他寫了一篇文章，哀悼亡故的恩師。,To mourn or express sorrow for someone who has passed away.,對於死去的人表達悲傷和懷念的情感。,社區舉辦了一個特別的活動，以哀悼最近去世的慈善家，感謝他對社會的貢獻。 / 在國慶日，大家雖然慶祝，但也不忘哀悼那些為國捨生忘死的英雄們。 / 許多學生寫下悼念詩篇，表達對已故老師的深切哀悼之情。 / 每當聽到那首熟悉的歌曲，心中便湧現出對已逝之人的深切哀悼。 / 在社會工作的領域，大家共同哀悼這位奮鬥不息的先驅，承諾繼續他的理想。 / 總統在演講中提到這位偉人的貢獻，並表達全國人民對他的深切哀悼。,vs-t/N,獻上哀悼 / 表達哀悼之情 / 深切哀悼 / 哀悼儀式 / 哀悼信 / 追思哀悼,āidào,ㄞ ㄉㄠˋ,
愛撫,3745,愛憐撫慰。[例]他下班回家後所做的第一件事，就是抱起沙發上的小貓愛撫一番。,To caress or stroke affectionately.,對某人或某物表現出愛憐和撫慰的行為，通常通過輕柔的觸碰。,她輕輕地愛撫著狗狗的毛，讓它立刻安靜下來。 / 在寒冷的冬天，朋友們的關心就像一種愛撫，讓我感到溫暖。 / 當她看到流浪貓時，忍不住彎下腰來，用手輕柔地愛撫牠。 / 在每個清晨，陽光透過窗簾照進來，彷彿在輕輕愛撫著大地。 / 這幅畫的色彩與筆觸，就像藝術家在愛撫每一寸空間一般。 / 她喜歡在閱讀時，手指輕輕愛撫著書頁，感受文字的溫度。,va-t/N,心靈愛撫 / 柔和的愛撫 / 愛撫小動物 / 輕柔地愛撫 / 溫暖的愛撫 / 愛撫肌膚,àifǔ,ㄞˋㄈㄨˇ,
哀嚎,3746,悲痛哭號。清．吳元炳《三賢政書．湯子遺書．卷一．報睢沭秋災疏》：「方種麥苗，俱沉水底；屋廬衝決，民無定所；眾姓哀嚎，傷心慘目。」清．俞益謨〈致黃欽錫妹丈〉：「若以此情達之千人，或一人意謂莫須有，而九百九十九人必唾面而罵為矯名欺詐之小人矣。某惟有踊地哀嚎，向天飲泣耳！」,To wail in grief; to cry out in sorrow due to pain or loss.,悲痛哭號。通常用來表達極大悲傷與痛苦。,在夜深人靜的時候，村莊裡傳來幾聲哀嚎，讓人感到不寒而慄。 / 老者的回憶中，戰爭過後的土地遍佈了哀嚎聲與淚水。 / 一些動物失去後代時，有類人類的反應，發出悲傷的哀號。 / 在電影的最後一幕，角色的哀嚎讓觀眾感受到無比的絕望與悲傷。 / 看著過去的照片，他的心中不禁發出一聲哀嚎，回憶如潮水般湧現。 / 每當想起失去的過去，他的心中就不由自主地哀嚎，感受到深深的懷念與遺憾。,n,悲傷的哀嚎 / 哀嚎聲 / 傳來哀嚎 / 心裡的哀嚎 / 幾聲哀嚎 / 哀嚎聲遍佈,āiháo,ㄞ ㄏㄠˊ,
哀號,3747,悲痛號哭。[例]他因腿上傷口疼痛，哀號了一夜。,To wail in grief; to lament loudly due to sorrow or pain.,悲痛地號哭。,小狗被車撞傷，牠在路旁痛苦地哀號著。 / 老人在家中看著老來的照片，想起過去的點點滴滴，不禁哀號著說自己太孤獨了。 / 她在失去愛犬後，無法忍受內心的痛楚，整夜哀號不止。 / 在戰爭的陰影下，許多母親得知子女失踪的消息，悲痛地哀號著呼喊他們的名字。 / 當他們看到家園被洪水沖毀，無法收拾一切，只能無助地坐在一旁哀號。 / 一位畫家在創作中，想到往昔的失敗與孤獨，忍不住哀號，讓情感在畫布上流露。,vp-i,忍不住哀號 / 悲傷地哀號 / 痛苦地哀號 / 哀號不止 / 傷心地哀號 / 哀號不已,āiháo,ㄞ ㄏㄠˊ,
愛恨,3748,,"A deep and complex mix of love and hate, often indicating conflicting emotions toward someone or something.",「愛恨」是指對某人或某事物同時產生的愛與恨兩種強烈的情感。,這首歌表達出愛恨交織的情感，讓每個聽過的人都能感同身受。 / 在這段戀情中，她常常感到愛恨難分，既想靠近又害怕受傷。 / 電視劇中的角色讓觀眾產生了愛恨情仇的複雜情感，令人難以忘懷。 / 她在追求夢想的過程中，經歷了愛恨交錯的掙扎，讓她的人生更加豐富。 / 每當回想起過去的回憶，他總是陷入愛恨糾葛之中，難以釋懷。 / 在朋友的建議下，他開始欣賞這位藝術家的作品，卻又對其背後的故事感到愛恨相織的矛盾。,n,愛恨情仇 / 愛恨交織 / 愛恨難分 / 愛恨之間 / 愛恨兩難 / 愛恨糾葛,àihèn,ㄞˋㄏㄣˋ,
挨家挨戶,3749,依照次序一家接著一家。[例]衛生單位派人，挨家挨戶的進行消毒工作，希望能杜絕病媒蚊的孳生。,"To visit each household in order, one after another.",依照次序，一家接著一家地進行某種行動。,社區的志工們挨家挨戶發放防疫資訊，提醒大家保持健康和安全。 / 在選舉期間，候選人會挨家挨戶拜訪選民，以爭取更多的支持。 / 在防災演習中，專業人員挨家挨戶宣導應急措施，以提高居民的防災意識。 / 在環境保護活動中，義工挨家挨戶發放垃圾分類指南，鼓勵居民參與綠色行動。 / 在寒冷的冬季，社會福利機構會挨家挨戶發放暖冬物資，幫助弱勢群體度過難關。 / 每當學校舉辦募款活動時，學生們會挨家挨戶尋求支持，為需要幫助的同學籌集資金。,idiom,挨家挨戶地探訪 / 挨家挨戶地走訪 / 挨家挨戶地調查 / 挨家挨戶地宣傳 / 挨家挨戶的服務 / 挨家挨戶拜訪,āijiāāihù,ㄞ ㄐㄧㄚ ㄞ ㄏㄨˋ,
礙事,3750,不方便、有所妨礙。[例]這張椅子放在這裡擋住了通道，真礙事。,Inconvenient; obstructive or in the way.,不方便，有所妨礙。,這個箱子放在玄關，實在礙事，讓人進出不方便。 / 我本來想借這把椅子，但它在我的辦公桌旁邊實在礙事。 / 他的一些老舊家具放在客廳，常常讓人覺得礙事。 / 每次開會時，那個不合時宜的話題都讓討論變得礙事。 / 我的朋友今天帶來的食物實在礙事，讓聚會變得有點混亂。 / 課堂上有人總是遲到，讓原本安靜的環境變得礙事。,vs-adj,礙事的東西 / 不想礙事 / 礙事的情況 / 實在礙事 / 真的礙事 / 礙事的感覺,àishì,ㄞˋㄕˋ,
哀痛,3751,哀傷悲痛。[例]爺爺的溘然長逝，帶給他無比的哀痛。,Grief and sorrow; deep sadness resulting from loss or misfortune.,深感悲傷和痛苦。,她從小失去摯友，心中時常充滿無法忍受的哀痛。 / 每當回想起與媽媽相處的點滴，他心中便涌現出難以言表的哀痛。 / 隨著時間的流逝，她心中的哀痛雖然稍有減輕，但仍然無法忘懷失去的愛人。 / 在這個特別的日子裡，他再次感受到過去那份深切的哀痛，使他無法平靜。 / 隨著朋友的離去，生活中的每一個角落都彌漫著無法消散的哀痛，讓他感到萬分孤獨。 / 當他看到舊照片時，心中涌起了一陣莫名的哀痛，回憶起那些美好的時光。,n,無法忍受的哀痛 / 深切的哀痛 / 心中的哀痛 / 難以言表的哀痛 / 真實的哀痛 / 長期的哀痛,āitòng,ㄞ ㄊㄨㄥˋ,
礙於,3752,,To be hindered or obstructed by something.,因為某種原因，造成行動或事情進行受到阻礙。,礙於天氣不好，我們不得不取消今天的戶外活動。 / 礙於資金不足，這個項目無法如期完成。 / 礙於交通擁堵，他遲到了重要的會議。 / 礙於法律的限制，他無法隨意改變公司的經營方向。 / 礙於技術問題，這項新產品的上市計劃被迫延遲。 / 礙於個人能力的不足，她感到這份工作壓力很大。,vs-i,礙於限制 / 礙於技術 / 礙於交通 / 礙於差異 / 礙於能力 / 礙於問題,àiyú,ㄞˋㄩˊ,
哀怨,3753,哀傷怨恨。[例]這首詞寫得極為哀怨動人，不愧出自名家手筆。,Sorrowful and resentful; expressing deep sadness and bitterness.,心中充滿悲傷和怨恨。,在風中傳來的哀怨聲音，彷彿是在訴說過去的悲傷故事。 / 她看著舊照片，眼中流露出一種深沉的哀怨，似乎在懷念失去的時光。 / 傳遞哀怨的歌聲在夜空中迴盪，深深觸動了每個人的心弦。 / 每當聽到那段旋律，他的心中便湧起一陣哀怨，回憶起那些無法忘懷的往事。 / 在寒風中，他的聲音顯得格外哀怨，彷彿在呼喚著遙遠的記憶。 / 這幅畫作透出一種哀怨的氛圍，讓觀者不由自主地思考生命的脆弱。,n,哀怨的歌聲 / 哀怨的心情 / 哀怨的眼神 / 傳遞哀怨 / 表達哀怨 / 哀怨的旋律,āiyuàn,ㄞ ㄩㄢˋ,
愛滋病,3754,由愛滋病毒所引起的疾病，一般經由血液或性行為傳染，能破壞人類的免疫系統，使人體失去抵抗疾病的能力。§英AIDS　△後天免疫缺乏症候群,"AIDS; A disease caused by the human immunodeficiency virus (HIV), typically transmitted through blood or sexual contact, that destroys the immune system and impairs the body's ability to resist infections and diseases.",由愛滋病毒引起的疾病，通常通過血液或性行為傳染，能夠破壞人體的免疫系統，使人失去抵抗疾病的能力。,許多社會團體舉辦講座，提高年輕人對愛滋病的認識與防治意識。 / 透過定期的愛滋病檢測，能夠及早發現問題並進行適當的治療。 / 愛滋病患者在社會上常常面臨歧視，造成他們的心理壓力很大。 / 政府應該加強對愛滋病的公共健康宣導，讓更多人了解這個疾病的傳播途徑。 / 了解愛滋病的傳染途徑，能幫助社會減少對患者的歧視。 / 對愛滋病的認識不僅限於醫療領域，還需要文化和教育的結合來消除偏見。,n,愛滋病病毒 / 愛滋病患者 / 愛滋病檢測 / 愛滋病治療 / 預防愛滋病 / 對抗愛滋病,àizī bìng,ㄞˋ ㄗ ㄅㄧㄥˋ,
諳,3755,熟悉、知曉。[例]他不諳水性，無法享受戲水的樂趣。,To be familiar with or knowledgeable about something.,熟悉某事或某種技能，能夠運用自如。,她雖然不諳這項運動的技巧，但還是努力嘗試，希望能夠學會。 / 如果你不諳這個行業的規則，就很容易犯錯。 / 他不諳音樂理論，卻依然能創作出動人的旋律。 / 不諳科技的人，可能對新的設備感到不知所措。 / 在這個快速變化的世界裡，不諳新趨勢的人可能會被淘汰。 / 即使不諳外語，她也勇敢地和世界各地的人交流。,vs-t,不諳規則 / 不諳理論 / 不諳技巧 / 不諳生活 / 不諳情勢 / 不諳技能,ān,ㄢ,
按兵不動,3756,暫時停住軍事行動，有觀望形勢的意思。今亦指負有任務卻不採取行動。[例]目前情勢未明，我們最好按兵不動，以免遭受損失。,"To temporarily halt military action, indicating a position of observation; also refers to holding a position with a task but not taking action.",暫時停止軍事行動，觀望形勢。現在也指負有任務卻不採取行動。,目前情況不明朗，我們決定暫時按兵不動，觀察事態發展。 / 雖然有對手在積極行動，但我們還是選擇按兵不動，評估風險。 / 近期市場波動，我的投資策略是按兵不動，避免不必要的損失。 / 按兵不動的策略讓我們在風險較高的時候保持了資源的安全。 / 儘管有機會出手，但當前的局勢下我們更傾向於按兵不動，以降低風險。 / 在這場競爭中，按兵不動的決策使我們為未來的行動留下了更多的選擇空間。,idiom,按兵不動的策略 / 按兵不動的時機 / 按兵不動的態度 / 暫時按兵不動 / 需要按兵不動 / 按兵不動保持觀望,àn bīng bù dòng,ㄢˋ ㄅㄧㄥ ㄅㄨˋ ㄉㄨㄥˋ,
按部就班,3757,原指作文章時，依照文義，安排章節，並將確切的詞句放在適當的位置。後指做事依照一定的層次、條理。語本《文選．陸機．文賦》。[例]這部機器只要照著指示，按部就班操作就可以了。,A systematic and orderly approach to doing things in a structured manner.,原本指寫文章時，按照文義安排章節，將合適的詞句放在適當位置。現在指做事情時，依照一定的層次和條理進行。,學習新課程的時候，按部就班地掌握基礎知識非常重要。 / 這部機器的手冊指示我們如何按部就班地進行操作，以確保安全。 / 在進行科學實驗時，研究人員必須按部就班，這樣才能得到準確的結果。 / 我們制定了按部就班的計畫，以確保每個階段的工作都能順利完成。 / 在學習語言的過程中，按部就班地練習聽說讀寫是提高水平的關鍵。 / 在做飯時，按照食譜按部就班地準備食材，可以做出美味的菜餚。,idiom,按部就班地進行 / 按部就班的步驟 / 按部就班地工作 / 按部就班地訓練 / 按部就班地發展 / 按部就班地執行,àn bù jiù bān,ㄢˋ ㄅㄨˋ ㄐㄧㄡˋ ㄅㄢ,
暗藏,3758,暗中隱藏。[例]暗藏禍心,To harbor ill intentions or hidden malice.,在暗中隱藏，不易察覺。,他跟你說的每一句話，背後可能都暗藏了他真正的目的。 / 這篇文章表面上在談論環保，卻暗藏了一些政治動機。 / 雖然他表面上很友善，但我總感覺他對我暗藏敵意。 / 她的話語中雖然充滿鼓勵，但我能感受到暗藏的失望與不安。 / 這本小說的情節曲折，許多角色之間都有暗藏的秘密。 / 在這段對話中，他的每個微笑似乎都暗藏著不為人知的故事與回憶。,vp-t,暗藏危機 / 暗藏秘密 / 暗藏敵意 / 暗藏風險 / 暗藏真相 / 暗藏陷阱,àncáng,ㄢˋㄘㄤˊ,
安插,3759,安置、安排。[例]他失業多時，不得已只好請朋友代為安插臨時職務。,To arrange or assign something in an appropriate position.,安置或安排某個人或物，使其處於特定位置或狀態。,她在父母的支持下，成功安插進一家知名的廣告公司，展開她的職業生涯。 / 為了提高工作效率，經理決定在團隊中安插一位專門負責數據分析的新員工。 / 他在社區活動中安插遊戲，遊戲有趣又輕鬆，讓大家更願意參加。 / 在這次會議上，主持人安插了一段互動環節，讓參與者能夠分享自己的看法。 / 他在自己的小說中安插了許多真實的歷史事件，讓故事更加引人入勝。 / 「在這個社會服務計畫中，我們希望能安插志工到各個需求急迫的機構，幫助更多人，並制定後續的安插方案以確保志工的有效運用。」,va-t,安插工作 / 安插人員 / 安插任務 / 安插遊戲 / 安插職位 / 安插時間,ānchā,ㄢ ㄔㄚ,
暗地,3760,偷偷的、私下。[例]他的自尊心很強，不肯接受幫助，我只好暗地裡接濟他。,Covertly; secretly or privately.,偷偷地、私下進行，不讓別人知道。,他總是暗地裡關心朋友的感受，卻不願意當面表達。 / 在公司裡，她經常暗地裡幫助同事，提升了團隊的凝聚力。 / 他明白這個計畫的重要性，所以暗地裡做了很多準備，卻不想讓上司知道。 / 為了保護孩子的隱私，老師常常暗地裡關注他們的心理變化。 / 他在比賽前暗地裡進行了很多訓練，最終取得了優異的成績。 / 我知道他心裡很感激那些暗地裡支持他的人，卻始終沒有適當的機會表達。,adv,暗地觀察 / 暗地裡計畫 / 暗地裡幫助 / 暗地保護 / 暗地支持 / 暗地裡進行,àn dì,ㄢˋ ㄉㄧˋ,
安放,3761,放置。《儒林外史》第二二回：「道士出來接著，安放行李，當晚睡下。」《紅樓夢》第六二回：「將這菱蕙安放好，又將些落花來掩了，方撮土掩埋平服。」,To place or set in position.,將物品放置在某個地方，通常是有目的或有序地安排好。,她小心翼翼地把花瓶安放在窗邊，讓陽光能夠照耀到。 / 在旅行的時候，我總是會把行李安放好，以免物品損壞。 / 在辦公室裡，他將每個文件安放在指定的位置，以方便日後查閱。 / 當她收到禮物時，會先安放好，然後再細細欣賞每一件心意。 / 在藝術展覽中，策展人小心翼翼地安放每一幅畫作，讓觀眾能夠欣賞到最佳的視覺效果。 / 這些珍貴的紀念品需要妥善安放位置，以避免在日常生活中損壞。,va-t,小心安放 / 安放物品 / 安放位置 / 妥善安放 / 安放回 / 安放好,ānfàng,ㄢ ㄈㄤˋ,
安分,3762,安守本分。《紅樓夢》第六四回：「噯，那一個是安分的，每日不是打架，就拌嘴。」《老殘遊記》第七回：「若是深知這人一定安分的，他就教他幾手拳棒，也十分慎重的。」也作「安分守己」。,To be content with one's duties and behave in a disciplined manner.,安守本分，不做超出自己能力或職責的事。,他為人安分老實，不喜歡攪擾別人的生活。 / 即使面對誘惑，這位安分的人仍然選擇堅守自己的原則。 / 在公司裡，安分工作的員工往往能得到長期的信任和重用。 / 她安分地過每一天，享受簡單而平靜的生活。 / 他總是安分地履行自己的職責，從不抱怨。 / 安分的心態讓我能夠更好地面對生活中的挑戰。,idiom,安分地生活 / 安分的心態 / 安分的工作 / 安分的性格 / 安分的人 / 安分地做事,ānfèn,ㄢ ㄈㄣˋ,
暗號,3763,祕密的口令或記號。[例]初次見面，他們約定暗號，以便能認出對方。,A secret code or signal; a predetermined phrase or gesture used to identify or recognize one another.,秘密的口令或記號，用來辨認對方。,偷偷溜進派對時，她用手勢傳遞暗號，讓朋友們知道她的到來。 / 他們在群組聊天中使用暗號，讓外人無法理解他們的對話內容。 / 這些童年玩伴常常用特定詞彙作為暗號，互相辨認。 / 他們制定了一套複雜的暗號系統，以便在嘈雜的環境中有效溝通。 / 每次遊戲開始前，玩家們都會先確認各自的暗號，以防止對手識破計劃。 / 為了保護機密資訊，他們在電子郵件中嵌入暗號，使未授權的人無法解讀。,n,使用暗號 / 掌握暗號 / 傳遞暗號 / 制定暗號 / 秘密暗號 / 隱藏的暗號,àn hào,ㄢˋ ㄏㄠˋ,
按鍵,3764,琴、打字機或其他機器上設定功能、可以按動的部分。[例]壓下那個紅色按鍵，飲水機就開始自動煮水。,"A button; A part on a piano, typewriter, or other machine that is pressed to set a function.",琴、打字機或其他機器上可設定功能的部分，按下後會產生作用。,我在手機上按下那個特殊按鍵，就可以立即拍照。 / 我常常按錯電腦的快捷按鍵，導致程式關閉得很快。 / 在新的汽車上，有一個專門的按鍵可以快速調整座椅的高度。 / 鬧鐘上的按鍵很小，因此我有時候會按錯而睡過頭。 / 這部相機的設定按鍵讓專業攝影師能夠快速調整拍攝模式。 / 無法找到冰箱的冷藏功能按鍵，讓我有點不知所措。,n,功能按鍵 / 專門的按鍵 / 特殊按鍵 / 按鍵操作 / 輸入按鍵 / 自動按鍵 / 按下按鍵,ànjiàn,ㄢˋㄐㄧㄢˋ,"冷藏, 快捷, 座椅, 睡"
安居樂業,3765,人民生活安定和樂，且都有自己喜好的工作。語本《漢書．卷九十一．貨殖傳．序》。[例]在戰火的蹂躪之下，人民絕對無法安居樂業。,"A state where people live in peace and stability, and enjoy their preferred work; This phrase emphasizes the contentment and security in both livelihood and employment.",人民生活安定快樂，並且都有自己喜歡的工作。,在這個和平的時代，人民終於可以安居樂業，不再擔心戰爭帶來的困擾。 / 這個小鎮的產業發展迅速，使得當地居民能夠實現安居樂業的理想，過上更好的生活。 / 為了促進經濟發展，政府鼓勵投資，創造更多的就業機會，讓人們享受安居樂業的生活。 / 社區舉辦的文化活動，不僅增進了鄰里之間的感情，還讓大家在樂趣中感受到安居樂業的幸福。 / 在這片美麗的土地上，隨著環保意識的提升，越來越多的人選擇在此安居樂業，守護我們共同的家園。 / 教育資源的公平分配，讓每個孩子都有機會接受良好教育，未來能夠實現安居樂業的夢想。,idiom,安居樂業的生活 / 安居樂業的生活 / 安居樂業的理想 / 安居樂業的環境 / 安居樂業的夢想 / 安居樂業的幸福,ānjūlèyè,ㄢ ㄐㄩ ㄌㄜˋ ㄧㄝˋ,鄰里
安樂,3766,平安喜樂。[例]他今生最大的願望，就是能令全家生活安樂。,Peaceful and joyful; characterized by safety and happiness in life.,生活平安而且快樂。,他的願望是讓家人都能過上安樂的生活。 / 每當家庭聚會時，大家都會分享彼此的生活，享受安樂的時光。 / 在這個快速變化的世界裡，許多人仍然追求安樂與平靜的心境。 / 每年慈善活動中，大家都心懷善念，努力讓更多人過上安樂的日子。 / 對許多夫妻來說，建立一個安樂的家庭環境是他們最大的心願。 / 除夕夜，全家團圓，共同享用年夜飯，祝願新的一年能夠安樂幸福。,n,安樂幸福 / 追求安樂 / 享受安樂 / 安樂的生活 / 生活安樂 / 安樂的家庭,ānlè,ㄢ ㄌㄜˋ,"善念, 心懷, 年夜飯"
按理,3767,,According to reason; a phrase indicating that something should logically happen or be understood.,「按理」指的是根據道理或常理推測某種情況或結果。,這個問題按理說應該很簡單，但實際上卻讓大家困惑了。 / 明天的會議按理應該會有很多人參加，但現在還沒收到確認。 / 他今天早該到，按理過去他總是準時的。 / 他的努力按理應該得到回報，但結果卻讓人失望。 / 他這次考試按理應能取得好成績，但卻發生了意外情況。 / 按理，今天的活動應該會很精彩，但天氣的變化讓我們擔心。,phrase,按理說 / 按理應該 / 按理判斷 / 按理希望 / 按理分析 / 按理推斷,ànlǐ,ㄢˋㄌㄧˇ,"理應, 理"
